title,id,flair,author,url,num_comments,score,timestamp
"Trimbakeshwar Temple, Nasik, Maharashtra",icixyb,Photography,4869_aptx,https://i.imgur.com/3xgGABU.jpg,20,104,2020-08-19 07:09:08
"The view from Khandagiri, Orissa",j7s8lh,Photography,MaybeNotTheChosenOne,https://i.redd.it/6r124n1wszr51.jpg,10,95,2020-10-09 04:02:54
"Dog found in Jaipur (OnePlus5, 1306x979)",djia7e,Photography,DismalSwitch2,https://i.imgur.com/xtfEfxs.jpg,94,1936,2019-10-18 04:25:35
An evening at Marine Drive,g7uegl,Photography,ayush_khanvilkar,https://i.redd.it/tk13vqxb5zu41.jpg,34,446,2020-04-25 14:29:55
"[OC] A view from our campsite in Dallapalli, Andhra Pradesh. 4608x2304, Shot on OnePlus 5T. F1.7 ISO100.",cr09rt,Photography,sai-kiran,https://i.redd.it/ts1pehl56qg31.jpg,93,2024,2019-08-16 02:51:25
"Socialism, Explained.",rkn8vv,Policy/Economy,Unnameda123,https://www.reddit.com/r/india/comments/rkn8vv/socialism_explained/,55,30,2021-12-20 13:26:33
"Under Rs 2.5 Lakh Crore Debt, Madhya Pradesh Plans Rs 2,000 Crore Statue",s11kr6,Policy/Economy,khushraho,https://www.ndtv.com/india-news/madhya-pradesh-to-install-shankaracharya-statue-costing-rs-2-000-crore-amid-massive-debt-2700631,110,689,2022-01-11 02:18:32
"Net direct tax collection jumps 60.8% to Rs 9.5 trillion in FY22 so far, signalling that the government may end up this fiscal year with a comfortable revenue position.",riyaj1,Policy/Economy,NuNuModi,https://www.business-standard.com/article/economy-policy/net-direct-tax-collection-jumps-60-8-to-rs-9-5-trillion-in-fy22-so-far-121121701400_1.html,18,92,2021-12-18 03:28:49
"Upcoming Crypto bill will ""seeks to prohibit all private cryptocurrencies in India, however, it allows for certain exceptions to promote the underlying technology of cryptocurrency and its uses. """,r0egcq,Policy/Economy,kukeon42,https://www.reddit.com/r/india/comments/r0egcq/upcoming_crypto_bill_will_seeks_to_prohibit_all/,106,77,2021-11-23 14:29:42
"AC 3 tier seat in Mangladweep Express. Just, why! Surely the ticket prices are high enough for proper maintenance at this point?",q96in0,Policy/Economy,thor_odinmakan,https://i.imgur.com/8FWfcNP.jpg,171,1550,2021-10-16 06:33:52
Fifth International Airport in UP | Art by Alok,r2fryr,Policy/Economy,mangoes_love,https://i.redd.it/rig27r2jlv181.jpg,32,440,2021-11-26 05:28:34
"Grocery costlier by 40%, edible oil by 50%",qzdpmg,Policy/Economy,shar72944,https://www.businesstoday.in/latest/economy-politics/story/covid-19-middle-class-inflation-spikes-due-to-fmcg-price-hikes-297720-2021-06-09,47,348,2021-11-22 05:10:50
"UN forecasts India's GDP to grow 6.5% in FY22 over 'solid path' to economic recovery, rapid vaccinations | Deccan Herald -",s3os99,Policy/Economy,apocalypse31a5,https://www.deccanherald.com/national/un-forecasts-indias-gdp-to-grow-65-in-fy22-over-solid-path-to-economic-recovery-rapid-vaccinations-1070925.html,5,25,2022-01-14 09:59:37
What's capitalism and communism?,s2zepu,Policy/Economy,atheistvegeta,https://www.reddit.com/r/india/comments/s2zepu/whats_capitalism_and_communism/,23,2,2022-01-13 13:26:07
Is the recent hike in GST rates justifiable?,rqdmnv,Policy/Economy,arshpreetkaurr,https://www.reddit.com/r/india/comments/rqdmnv/is_the_recent_hike_in_gst_rates_justifiable/,20,28,2021-12-28 11:18:17
Watch: NITI Aayog officials in knots trying to explain report on skyrocketing unemployment [old],rq7uz7,Policy/Economy,viksi,https://scroll.in/video/911672/watch-niti-aayog-officials-in-knots-trying-to-explain-report-on-skyrocketing-unemployment,10,117,2021-12-28 05:27:56
Ola and Uber drivers cancel if not a Cash ride,ri91fw,Policy/Economy,Change_petition,https://www.reddit.com/r/india/comments/ri91fw/ola_and_uber_drivers_cancel_if_not_a_cash_ride/,29,59,2021-12-17 04:30:40
"Four day workweek, new salary structure, to be implemented soon",rmfkiz,Policy/Economy,_batteryacid925,https://www.newindianexpress.com/nation/2021/dec/21/four-day-workweek-new-salary-structure-to-be-implemented-in-india-soon-2398147.html,24,45,2021-12-22 21:43:30
Why MSP can't be made a legal right....here's the economic answer,qzg8zc,Policy/Economy,anny007,https://www.reddit.com/r/india/comments/qzg8zc/why_msp_cant_be_made_a_legal_rightheres_the/,85,168,2021-11-22 07:50:53
India's jobs crisis is more serious than it seems,s34s8b,Policy/Economy,mayblum,https://www.bbc.com/news/world-asia-india-59870297,6,36,2022-01-13 17:32:43
"Tomato prices at Rs 80/kg in most cities, rise up to Rs 120/kg in south",r1o6c2,Policy/Economy,keh_k_lenge,https://wap.business-standard.com/article-amp/current-affairs/tomato-prices-at-rs-80-kg-in-most-cities-rise-up-to-rs-120-kg-in-south-121112301115_1.html?utm_source=SEO&utm_medium=ST,67,219,2021-11-25 04:43:04
Global GDP 2021.,roqy7q,Policy/Economy,Soundar_,https://i.redd.it/16r88ce1xt781.jpg,14,98,2021-12-26 06:14:22
India is now a $3.1 trillion economy - Times of India,rycbvz,Policy/Economy,ShinjisUnit01,https://timesofindia.indiatimes.com/business/india-business/india-is-now-a-3-1-trillion-economy/articleshow/88761957.cms,12,27,2022-01-07 17:10:09
"Rs 2,000 denomination now 15.1% of total value of notes in circulation",rbik0h,Policy/Economy,Indianopolice,https://indianexpress.com/article/business/banking-and-finance/rs-2000-denomination-now-15-1-of-total-value-of-notes-in-circulation-7661448/,36,176,2021-12-08 04:23:53
A coconut seller and a day laborer reflect on life in astoundingly unequal India,rqwjj4,Policy/Economy,Impressive-Nose9110,https://www.npr.org/sections/goatsandsoda/2021/12/23/1065267029/a-coconut-seller-and-a-day-laborer-reflect-on-life-in-astoundingly-unequal-india,11,124,2021-12-29 02:19:50
Your mom was right: Facebook is bad for you!,qgpew6,Policy/Economy,InternetFreedomIn,https://www.reddit.com/r/india/comments/qgpew6/your_mom_was_right_facebook_is_bad_for_you/,161,1575,2021-10-27 05:28:55
Explanation regarding currently ongoing Doctors protest in Delhi. #ExpediteNEETPGCounselling2021,rps2hu,Policy/Economy,cookie_mon90,https://www.reddit.com/gallery/rps2hu,10,204,2021-12-27 17:10:27
"Once touted as the next big growth story after China, India has failed to utilise its young people.",rpog9v,Policy/Economy,Neon_Alchemist,https://scroll.in/article/1013555/how-india-is-wasting-its-potential-demographic-dividend,10,199,2021-12-27 14:16:21
India’s wholesale prices unexpectedly rise to three-decade high,rg2zpy,Policy/Economy,badbola,https://www.livemint.com/news/india/indias-wholesale-prices-unexpectedly-rise-to-a-three-decade-high-11639470103149.html,15,151,2021-12-14 08:28:25
‘India to surpass Japan as Asia’s 2nd largest economy by 2030’,s03fhh,Policy/Economy,Straight_Finding_756,https://www.thehindu.com/business/india-to-surpass-japan-as-asias-2nd-largest-economy-by-2030/article38195975.ece,18,9,2022-01-09 22:28:19
"2 India’s, slums and skyscrapers. (More in comments)",r9vlj2,Policy/Economy,kraken_enrager,https://i.redd.it/5xkbvs1bxt381.jpg,32,112,2021-12-06 01:59:20
Vedanta puts $12 billion price tag on Bharat Petroleum,s3n4i2,Policy/Economy,NewMeNewWorld,https://economictimes.indiatimes.com/industry/energy/oil-gas/vedanta-puts-12-billion-price-tag-on-bharat-petroleum/articleshow/88876066.cms,9,4,2022-01-14 08:09:06
Indore police deploys goons to control traffic to bring down crime rate,rdwee9,Policy/Economy,thelielmao,https://www.etvbharat.com/english/national/bharat/indore-police-deploys-goons-to-control-traffic-to-bring-down-crime-rate/na20211211125007973,16,100,2021-12-11 09:41:30
"Kejriwal Govt Not Distributing Food to Vulnerable Families Lacking Ration Cards, Survey Reveals",s58rut,Policy/Economy,rahulthewall,https://m.thewire.in/article/government/kejriwal-delhi-govt-vulnerable-families-ration-cards-survey,5,7,2022-01-16 10:06:17
GST Rates on Automobiles,rh33lm,Policy/Economy,Free_Physics,https://i.imgur.com/ZsHoTXm.png,14,75,2021-12-15 16:34:00
25 paise and 50 paise coins are still legal tender in India💀,rs6tbw,Policy/Economy,_meme_caster_,https://www.reddit.com/gallery/rs6tbw,10,22,2021-12-30 17:15:58
"10 worrying signals for India on inflation, unemployment, inequality",rkl7m5,Policy/Economy,apocalypse31a5,https://www.nationalheraldindia.com/india/10-worrying-signals-for-india-on-inflation-unemployment-inequality,12,69,2021-12-20 11:27:14
Only 1 Woman Member in Parliamentary Panel that will Examine Bill to Raise Legal Age of Marriage,ruoa3b,Policy/Economy,thewebdev,https://www.tribuneindia.com/news/nation/only-1-woman-member-in-parliamentary-panel-that-will-examine-bill-to-raise-legal-age-of-marriage-357337,4,71,2022-01-03 00:43:19
"Since 1990, India's economy has actually not grown at all，why?",rsl7qy,Policy/Economy,Simon-1983,https://www.reddit.com/r/india/comments/rsl7qy/since_1990_indias_economy_has_actually_not_grown/,13,14,2021-12-31 04:19:50
Neoliberalism and Democracy,rou4ag,Policy/Economy,Unnameda123,https://www.reddit.com/r/india/comments/rou4ag/neoliberalism_and_democracy/,18,12,2021-12-26 10:05:02
Why Dr. Manmohan Singh deserves the Nobel Prize in economics,qxwlpg,Policy/Economy,GobhiHaiToPumpkinHai,https://timesofindia.indiatimes.com/blogs/courts-commerce-and-the-constitution/165065/,57,171,2021-11-20 03:21:22
A Game Changer for Indian Economic Boom: DFC Project,ryuze3,Policy/Economy,rustoo,https://www.youtube.com/watch?v=mSsRmbUnvK4,5,26,2022-01-08 08:12:16
What's your take on the upcoming budget?,s5wqb6,Policy/Economy,tellnow,https://www.reddit.com/r/india/comments/s5wqb6/whats_your_take_on_the_upcoming_budget/,10,0,2022-01-17 06:06:14
Public Affairs Index (PAI) 2021 of Indian States,qlnjty,Policy/Economy,Eldho_Basil_Siji,https://i.redd.it/hvbp4z7kfbx71.jpg,99,385,2021-11-03 05:22:58
"4-day work-week, change in salary: India's new labour codes likely in FY 2022-23 | Latest News India",rlxdpw,Policy/Economy,myflowergift07,https://www.hindustantimes.com/india-news/4day-work-week-change-in-salary-india-s-new-labour-codes-likely-in-fy-202223-101639970476730.html,13,49,2021-12-22 04:53:43
"How not to develop a hill station | Dehradun was once a pristine town dotted with canals and fruit orchards. Today, it is choked and polluted, testament to a colossal failure of urban planning.",rgt71r,Policy/Economy,rahulthewall,https://scroll.in/article/1012794/how-not-to-develop-a-hill-station,16,98,2021-12-15 07:06:27
Legend Jaspal Bhatti predicted this !,qdi55k,Policy/Economy,nkj94,https://i.redd.it/bletegy0i0v71.png,76,1998,2021-10-22 14:30:13
"The draft #cryptocurrecy bill that is available punishes mining, holding, selling, issuing, transfer or use of #cryptocurrency a criminal offence with a 10 year jail time. That's equal to punishment for money laundering.",r1s67s,Policy/Economy,avinassh,https://twitter.com/Memeghnad/status/1463189891840299019?s=20,50,126,2021-11-25 08:44:39
India's economy's the loser in the Amazon-Ambani regulatory slugfest for Future,ryquwu,Policy/Economy,Impressive-Nose9110,https://www.livemint.com/opinion/online-views/indias-economy-s-the-loser-in-the-amazon-ambani-regulatory-slugfest-for-future-11641477818372.html,4,64,2022-01-08 04:03:07
Indian rupee to end year as Asia’s worst-performing currency,rpgygo,Policy/Economy,Impressive-Nose9110,https://www.aljazeera.com/economy/2021/12/21/indian-rupee-to-end-year-as-asias-worst-performing-currency,9,72,2021-12-27 06:34:38
"Stalls selling non-vegetarian items will not be allowed along public roads & in the 100-meter radius of schools, colleges & religious places, Town Planning Committee of Ahmedabad Municipal Corporation has decided. The execution will start tomorrow: Committee Chairman Devang Dani",quj7nt,Policy/Economy,SacredBullshit,https://twitter.com/ANI/status/1460254914928463879,72,225,2021-11-15 15:41:35
"Growing old before it gets rich, India has a people problem",rhjrbd,Policy/Economy,NewMeNewWorld,https://www.business-standard.com/article/economy-policy/growing-old-before-it-gets-rich-india-has-a-people-problem-121121600186_1.html,16,117,2021-12-16 05:39:22
Interview | Current Regime Has No Regard for the Poor: Amartya Sen,s3ngca,Policy/Economy,Impressive-Nose9110,https://thewire.in/politics/amartya-sen-interview-inequality-democracy,4,27,2022-01-14 08:30:18
"In Goa, buying a beer is cheaper than fuel, tomatoes",renb3a,Policy/Economy,OhMySkipper,https://m.timesofindia.com/city/goa/in-goa-buying-a-beer-is-cheaper-than-fuel-tomatoes/articleshow/88233192.cms,16,112,2021-12-12 11:36:25
"Video of official shouting at visa applicant in New York goes viral, consulate responds",r6zwn6,Policy/Economy,thelielmao,https://www.hindustantimes.com/india-news/video-of-official-shouting-at-visa-applicant-in-new-york-goes-viral-consulate-responds-101638407432116.html,27,99,2021-12-02 05:29:25
₹5 coin I collected till now....tell me any other editions left to be collected,rspbfw,Policy/Economy,passionatepussylover,https://i.redd.it/qa90r9eq9u881.jpg,12,92,2021-12-31 08:29:38
Recent Bill passed - regarding increasing the marriageable age for girls,rm6p7o,Policy/Economy,Specialist-Piglet836,https://www.reddit.com/r/india/comments/rm6p7o/recent_bill_passed_regarding_increasing_the/,17,22,2021-12-22 14:48:06
Indian States By remittances received,rmbr2o,Policy/Economy,nkj94,https://i.redd.it/8lnebzmq25781.png,55,248,2021-12-22 18:42:13
Rs 1 Lakh Fine For Plea Against PM Photo On Vaccine Certificates,rl9rin,Policy/Economy,CorruptPoliticn,https://www.ndtv.com/india-news/plea-against-pm-photo-on-vaccine-certificate-rejected-with-rs-1-lakh-fine-2662653/amp/1,59,403,2021-12-21 08:04:38
From NITI Ayog's Multidimensional Poverty Index (MPI) Report,r2rm9t,Policy/Economy,Eldho_Basil_Siji,https://i.redd.it/di0xkggqzy181.jpg,229,753,2021-11-26 16:53:33
Average data consumption for a mobile user is 14 GB per month: DoT,rq4o0f,Policy/Economy,Indianopolice,https://www.financialexpress.com/industry/average-data-consumption-for-a-mobile-user-is-14-gb-per-month-dot/2391461/,67,153,2021-12-28 02:49:09
"Modi shrank India’s workforce by a fifth: Labour force participation is 40 per cent in India, lower than Pakistan and the lowest in South Asia for the first time",rvfje9,Policy/Economy,Impressive-Nose9110,https://frontline.thehindu.com/economy/interview-aakar-patel-modi-shrank-india-workforce-by-a-fifth/article37935600.ece,29,298,2022-01-03 23:40:34
Modi banning crypto is so funny to me,r0joi6,Policy/Economy,RecklessPP123,https://www.reddit.com/r/india/comments/r0joi6/modi_banning_crypto_is_so_funny_to_me/,410,495,2021-11-23 18:27:26
"Don't come to our temples, but don't also go to their churches - upper caste anti conversion bill in summary",rpvynk,Policy/Economy,mike_testing,https://www.reddit.com/r/india/comments/rpvynk/dont_come_to_our_temples_but_dont_also_go_to/,64,258,2021-12-27 20:03:34
This is what resident doctors in India are forced to do right now. What they have been reduced to for the sake of their and everyone else's future. #NEETPG #FORDA #RESIDENTSTRIKE,rpmrch,Policy/Economy,cookie_mon90,https://v.redd.it/jqrycl7az2881,51,441,2021-12-27 12:44:03
"India to allow in imports of US pork and products, US officials say",s15dlt,Policy/Economy,Impressive-Nose9110,https://www.cnn.com/2022/01/10/economy/india-us-pork-trade-intl-hnk/index.html,43,71,2022-01-11 05:34:11
PM modi just tweeted an article from swarajyamag. Looks like we're in the endgame now.,ryafvy,Policy/Economy,rogan_doh,https://www.reddit.com/r/india/comments/ryafvy/pm_modi_just_tweeted_an_article_from_swarajyamag/,37,185,2022-01-07 15:50:00
Petrol Prices in Asia,qjj2su,Policy/Economy,gubenilekani,https://i.redd.it/8k41c5y94qw71.jpg,651,4613,2021-10-31 05:42:31
"As the Pandemic ravaged Indian economy, Central Government collected ₹3,72,970 crore, in excise duty & different cesses from Indians on Petroleum products, 66% more than previous year, Minister answers in Parliament.",rkjatz,Policy/Economy,NuNuModi,https://i.redd.it/jcs78vhy0o681.jpg,86,686,2021-12-20 09:21:32
"Current Regime Has Complete Disregard For the Poor, Seeing a Big Slide in Democracy: Amartya Sen",s207t7,Policy/Economy,anonymouse_2001,https://www.youtube.com/watch?v=8Ao6yc6T5Xo,37,164,2022-01-12 07:16:27
"Oxfam report: In 2021, income of 84% households fell, but number of billionaires grew",s5usnj,Policy/Economy,0abhi,https://indianexpress.com/article/india/oxfam-report-2021-income-households-fell-7726844/,34,94,2022-01-17 04:21:58
Modi's Folly,rwr7ja,Policy/Economy,kullky_2020,https://www.reddit.com/r/india/comments/rwr7ja/modis_folly/,72,163,2022-01-05 16:48:06
What is the minimum wage in India?,ryun5m,Policy/Economy,lockkheart,https://www.reddit.com/r/india/comments/ryun5m/what_is_the_minimum_wage_in_india/,76,129,2022-01-08 07:48:54
Inequality.,rd7o1c,Policy/Economy,sudden_dust,https://i.redd.it/kuju1rc8mp481.jpg,193,1218,2021-12-10 12:34:16
Government To Own 36% In Vodafone Idea In New Rescue Plan,s14s3q,Policy/Economy,pungentcunt,https://www.ndtv.com/business/government-to-hold-35-8-in-vodafone-idea-after-converting-dues-2700883#pfrom=home-ndtv_bigstory,68,185,2022-01-11 05:02:06
"India's jobs crisis is more serious than it seems: unemployment way higher than anything seen in India, at least over the last three decades",rxty9l,Policy/Economy,Impressive-Nose9110,https://www.bbc.com/news/world-asia-india-59870297,73,574,2022-01-07 00:47:13
"Farm Laws Will Be Repealed In Upcoming Parliament Session, Says Prime Minister",qx7kn5,Policy/Economy,sukhman_mann_,https://www.livelaw.in/top-stories/farm-laws-will-be-repealed-in-upcoming-parliament-session-says-prime-minister-185862,927,3752,2021-11-19 03:52:25
I am poor?,rv94gm,Policy/Economy,orangepoopsickle,https://www.reddit.com/r/india/comments/rv94gm/i_am_poor/,205,432,2022-01-03 19:00:20
Why is the value of rupee diminishing?,s1qn91,Policy/Economy,atheistvegeta,https://www.reddit.com/r/india/comments/s1qn91/why_is_the_value_of_rupee_diminishing/,40,26,2022-01-11 23:15:47
"India to become 3rd largest economy in 2031, says CEBR",rqa0xx,Policy/Economy,kj4778,https://www.livemint.com/economy/india-to-become-3rd-largest-economy-in-2031-says-cebr-11640510927249.html,25,37,2021-12-28 07:28:36
"For those 'India is a super power' people, what metrics are you looking at to conclude this? I'm surprised that in GDP per capita terms, India falls below 25 out of the 54 African countries",r7pmm2,Policy/Economy,xc91fapstrocar,https://www.reddit.com/gallery/r7pmm2,146,408,2021-12-03 03:48:44
"As global funds shun India, rupee turns into worst currency in Asia",rl75ee,Policy/Economy,bhodrolok,https://www.business-standard.com/article/finance/as-global-funds-shun-india-rupee-turns-into-worst-currency-in-asia-121122100131_1.html,61,193,2021-12-21 05:25:34
Half of India is so poor it owns almost nothing,rbzc74,Policy/Economy,divxforce,https://qz.com/india/2099957/world-inequality-report-says-india-is-poor-but-with-rich-elite/,56,142,2021-12-08 19:48:01
Labor rights in India are a joke...,rjublp,Policy/Economy,TheBlockChainVillage,https://www.reddit.com/r/india/comments/rjublp/labor_rights_in_india_are_a_joke/,23,197,2021-12-19 10:45:41
Great Haircut story,r6fxhk,Policy/Economy,Desperate_Ad_1494,https://i.redd.it/m7yvwrs0yx281.jpg,61,284,2021-12-01 14:26:19
What's the state-wise health insurance coverage in India?,rwo7ha,Policy/Economy,harddisc,https://i.redd.it/9zx7kccjqv981.jpg,11,87,2022-01-05 14:30:11
Lok Sabha passes bill to link electoral rolls with Aadhaar,rklky5,Policy/Economy,badbola,https://www.livemint.com/news/india/lok-sabha-passes-bill-to-link-electoral-rolls-with-aadhaar-11639994506580.html,36,80,2021-12-20 11:50:23
"After diluting bidding-clause, Modi govt sold off CEL to furniture-making firm, employees hold dharna",s1alym,Policy/Economy,thewebdev,https://www.nationalheraldindia.com/india/after-diluting-bidding-clause-modi-govt-sold-off-cel-to-furniture-making-firm-employees-hold-dharna,11,45,2022-01-11 11:14:42
"What does the phrase ""The middle class"" mean to you?",r11u5w,Policy/Economy,spacecowboy45,https://www.reddit.com/r/india/comments/r11u5w/what_does_the_phrase_the_middle_class_mean_to_you/,127,185,2021-11-24 10:05:43
India-China trade grows to record $125 billion in 2021 despite tensions in eastern Ladakh,s54nza,Policy/Economy,ganjappa,https://economictimes.indiatimes.com/news/economy/foreign-trade/india-china-trade-grows-to-record-125-billion-in-2021-despite-tensions-in-eastern-ladakh/articleshow/88900383.cms,7,64,2022-01-16 05:35:41
Video: Girl Turns Reporter To Show Bad Condition Of Kashmir Roads,s1539u,Policy/Economy,Malgebra,https://www.ndtv.com/india-news/little-girl-turns-reporter-to-show-bad-condition-of-kashmir-roads-2700052#pfrom=home-ndtv_lateststories,8,113,2022-01-11 05:19:02
There was a trend where people were clicking images at Fuel pumps that have Modi’s banner. Let’s restart and scale up the #ThankYouModijiChallenge as a way to protest increasing fuel prices. Add your local and state governments to this as well. Spare no one.,qk7mqv,Policy/Economy,duckinggr8,https://i.redd.it/y0xaaknpbxw71.jpg,154,3535,2021-11-01 05:56:27
"Adani Enterprises bags Ganga expressway project, India's largest, in UP",rl7o8e,Policy/Economy,ManufacturerFar8645,https://www.business-standard.com/article/companies/adani-enterprises-bags-ganga-expressway-project-india-s-largest-in-up-121122001115_1.html,33,154,2021-12-21 05:55:00
It has been 12 years since Aadhaar was launched and even government officials still don't understand that it is a digital document!,r0dwel,Policy/Economy,SoggyMonsoon,https://www.reddit.com/r/india/comments/r0dwel/it_has_been_12_years_since_aadhaar_was_launched/,102,677,2021-11-23 14:02:12
Central Government Earned Rs 8 Lakh Crore From Taxes On Fuels In Last 3 Years,rhhxjw,Policy/Economy,NuNuModi,https://www.ndtv.com/business/govt-earned-over-rs-8-lakh-cr-from-taxes-on-petrol-diesel-in-last-3-fiscals-sitharaman-2651062,37,257,2021-12-16 04:00:09
Common man problems ft Modi | Art by Alok,r0xx07,Policy/Economy,mangoes_love,https://i.redd.it/mdoojazhgh181.jpg,66,1417,2021-11-24 05:55:26
Regulations on EdTech Startups like Byju's! What is your opinion?,rgcs1d,Policy/Economy,ablueflamer,https://www.bbc.com/news/world-asia-india-58951449,43,306,2021-12-14 17:41:21
"JUST IN: India's wholesale inflation surges to 14.2% in November, the fastest pace in 30 years. The shock could feed into retail prices and threaten the central bank's case to keep rates lower for longer.",rg5qag,Policy/Economy,InsomniacNimrod,https://www.bloomberg.com/news/articles/2021-12-14/india-s-wholesale-prices-unexpectedly-rise-to-three-decade-high?cmpid%3D=socialflow-twitter-economics&utm_campaign=socialflow-organic&utm_content=economics&utm_medium=social&utm_source=twitter,53,300,2021-12-14 11:42:37
Kerala Tops Happiness Index in the country,r38msa,Policy/Economy,iamrahul10,https://i.imgur.com/i7S6FFe.jpg,143,503,2021-11-27 07:52:09
"India’s Richest More Than Double Their Fortunes During Covid Crisis, Oxfam Says",s5vjxk,Policy/Economy,Impressive-Nose9110,https://www.bloomberg.com/news/articles/2022-01-17/tax-the-rich-in-country-with-biggest-poverty-surge-oxfam-says,18,34,2022-01-17 05:02:34
"Telangana is building a ‘command and control centre’ that can help them track YOU across 600,000 cameras! #BanTheScan",qs3ug6,Policy/Economy,InternetFreedomIn,https://www.reddit.com/gallery/qs3ug6,185,1678,2021-11-12 05:00:00
India has spent a decade wasting the potential of its young population,rofxja,Policy/Economy,ashkr512,https://qz.com/india/2104191/india-has-wasted-the-potential-of-its-large-young-population/,37,219,2021-12-25 19:37:37
"Global economy heads for a sharp slowdown, India to grow at 8.3%: World Bank | Latest News India",s1xcg6,Policy/Economy,East-Secretary,https://www.hindustantimes.com/india-news/global-economy-heads-for-a-sharp-slowdown-india-to-grow-at-8-3-world-bank-101641915575770.html,19,77,2022-01-12 04:33:06
A new breed of people: Inflation Supporters,qnq2d4,Policy/Economy,sankalp89,https://www.reddit.com/r/india/comments/qnq2d4/a_new_breed_of_people_inflation_supporters/,364,1785,2021-11-06 01:48:32
Reliance to invest $80 billion in green energy projects in Gujarat,s2xtra,Policy/Economy,NewMeNewWorld,https://economictimes.indiatimes.com/industry/renewables/reliance-to-invest-80-billion-in-green-energy-projects-in-gujarat/articleshow/88877199.cms?utm_source=ETTopNews&utm_medium=HPTN&utm_campaign=AL1&utm_content=23,4,18,2022-01-13 11:57:56
"Arrest Warrant In 2014 Case Against SP Maurya, Who Quit Team Yogi Yesterday",s24g91,Politics,raks1991,https://www.ndtv.com/india-news/arrest-warrant-against-sp-maurya-who-quit-team-yogi-yesterday-for-2014-hate-speech-2703898,57,380,2022-01-12 11:48:48
"First they came for beef, now they are coming after meat and egg",qtlrg6,Politics,gubenilekani,https://i.redd.it/xwd04knbyiz71.jpg,428,2006,2021-11-14 08:49:09
Goa| We'll provide Rs 1000 to every woman above 18 yrs of age. The tourism sector will be developed as per international standards. Goa will have 24×7 free electricity & water. Roads will be improved & free education will be given in all govt schools: AAP convenor Arvind Kejriwal,s55m3y,Politics,WhiteShirttBlueJeans,https://twitter.com/ANI/status/1482596238680014849?t=zSbdNwn5TKLvZK-MNXlZ-g&s=19,116,160,2022-01-16 06:31:06
Hindu bigots are openly urging Indians to murder Muslims,s47fdx,Politics,Straight_Finding_756,https://www.economist.com/leaders/2022/01/15/hindu-bigots-are-openly-urging-indians-to-murder-muslims?utm_medium=social-media.content.np&utm_source=twitter&utm_campaign=editorial-social&utm_content=discovery.content,97,236,2022-01-15 00:45:00
PM modi's photo removed from vaccine certificate in five states,s0ccdz,Politics,dreamdrippedup,https://youtu.be/fb8w7s2bSL0,85,647,2022-01-10 05:38:21
