title,id,flair,author,url,num_comments,score,timestamp
I am a lesser known Indian author. My 2nd book was launched for pre-booking on 14th. AMA,5unqxo,AMA,legalindia,https://www.reddit.com/r/india/comments/5unqxo/i_am_a_lesser_known_indian_author_my_2nd_book_was/,145,93,2017-02-17 18:27:13
"I am Sanjeev Sabhlok, joined IAS in 1982 and resigned in 2001 to uproot socialism from India. I have founded India’s only liberal party - Swarna Bharat Party to transform India. Ask Me Anything!",9mxy2y,AMA,sabhlok,https://www.reddit.com/r/india/comments/9mxy2y/i_am_sanjeev_sabhlok_joined_ias_in_1982_and/,304,187,2018-10-10 09:30:47
"Hey, Reddit India. We are the founding editors of The Wire & you can ASK US ANYTHING",8idukp,AMA,thewire_in,https://www.reddit.com/r/india/comments/8idukp/hey_reddit_india_we_are_the_founding_editors_of/,293,418,2018-05-10 10:26:40
"Hi I'm Shashi Tharoor. Ask me Anything on India, politics, foreign affairs, history, and more!",626l9b,AMA,shashitharoor2017,https://www.reddit.com/r/india/comments/626l9b/hi_im_shashi_tharoor_ask_me_anything_on_india/,496,1602,2017-03-29 13:25:30
"AMA on Aadhaar with Kiran Jonnalagadda, Anivar Aravind, Prasanna S, Reetika Khera, Nikhil Pahwa, Chinmayi Arun, Thejesh GN, Saikat Dutta, Anand V and Anjali Bharadwaj",7sw2bj,AMA,kumbhakaran,https://www.reddit.com/r/india/comments/7sw2bj/ama_on_aadhaar_with_kiran_jonnalagadda_anivar/,458,313,2018-01-25 13:31:13
"Hey Reddit, I'm Dhruv Rathee, Youtuber and Activist. AMA!",84dbn1,AMA,dhruvrathee,https://www.reddit.com/r/india/comments/84dbn1/hey_reddit_im_dhruv_rathee_youtuber_and_activist/,341,371,2018-03-14 13:21:23
"Hi, I am Kunal Kamra. Ask me anything",8cdgww,AMA,KunalKamra,https://www.reddit.com/r/india/comments/8cdgww/hi_i_am_kunal_kamra_ask_me_anything/,297,366,2018-04-15 06:21:36
"Hi, I'm Atishi, the East Delhi Lok Sabha in-charge of Aam Aadmi Party and you can Ask Me Anything beginning at 2 pm IST",a880qb,AMA,atishi_aap,https://www.reddit.com/r/india/comments/a880qb/hi_im_atishi_the_east_delhi_lok_sabha_incharge_of/,103,278,2018-12-21 08:33:52
"Hi, I'm Dilip Pandey, the North-East Delhi Lok Sabha candidate for Aam Aadmi Party and you can Ask Me Anything beginning at 2 pm IST.",b42hra,AMA,dilipkpandey,https://www.reddit.com/r/india/comments/b42hra/hi_im_dilip_pandey_the_northeast_delhi_lok_sabha/,133,70,2019-03-22 08:23:47
Bare breast protest against hypersexualising female body: Arathy speaking,8624g8,AMA,ArathySA,https://www.reddit.com/r/india/comments/8624g8/bare_breast_protest_against_hypersexualising/,246,303,2018-03-21 13:38:35
"Hi Reddit, I'm gaurav siddharth, Guinness World Record holder for the longest bike journey in a single country - 1,22,000 kms. Ask Me Anything, just anything!",82ep0r,AMA,gauravsiddharth,https://www.reddit.com/r/india/comments/82ep0r/hi_reddit_im_gaurav_siddharth_guinness_world/,201,362,2018-03-06 12:30:11
Hi this is Harsha Bhogle. AMA,6i671c,AMA,bhogle-harsha,https://www.reddit.com/r/india/comments/6i671c/hi_this_is_harsha_bhogle_ama/,322,520,2017-06-19 12:51:43
"Hi, I'm Milan Vaishnav and you can Ask Me Anything beginning at 9 am EST/7:30 pm IST",a309io,AMA,milan_vaishnav,https://www.reddit.com/r/india/comments/a309io/hi_im_milan_vaishnav_and_you_can_ask_me_anything/,120,99,2018-12-04 12:31:43
I am Sanjeev Sabhlok who joined the IAS in 1982 and resigned in Jan 2001. Ask me anything for 1 hour.,8p9hzm,AMA,sabhlok,https://www.reddit.com/r/india/comments/8p9hzm/i_am_sanjeev_sabhlok_who_joined_the_ias_in_1982/,165,202,2018-06-07 11:22:13
"Hey r/india, I am a Intraday Trader who made 29L+ in FY 2017-18 on a capital of 10L. Would love to dispense some misconceptions about Intraday Trading. AMA",8hehlq,AMA,intraday_trader,https://www.reddit.com/r/india/comments/8hehlq/hey_rindia_i_am_a_intraday_trader_who_made_29l_in/,200,149,2018-05-06 10:55:40
"Hi this is Vinay & Khushboo, the directors of ""An Insignificant Man"". Ask us anything!",7mtu4c,AMA,shukla_vinay,https://www.reddit.com/r/india/comments/7mtu4c/hi_this_is_vinay_khushboo_the_directors_of_an/,204,259,2017-12-29 11:34:44
"Let's slay misandry!! Hi guys, I am Amit Deshpande. A men's rights activist from past few years now. So we begin with the AMA",7dcctp,AMA,antidespondent,https://www.reddit.com/r/india/comments/7dcctp/lets_slay_misandry_hi_guys_i_am_amit_deshpande_a/,310,134,2017-11-16 13:24:38
"Hey, Reddit India. We are the founding editors of The Wire & you can ASK US ANYTHING",6ajr5p,AMA,thewire_in,https://www.reddit.com/r/india/comments/6ajr5p/hey_reddit_india_we_are_the_founding_editors_of/,469,153,2017-05-11 12:21:06
"VP, Internet.org",3ya52q,AMA,Chris-Daniels,https://www.reddit.com/r/india/comments/3ya52q/vp_internetorg/,590,659,2015-12-26 12:37:39
"Hello Reddit, after several years as a McKinsey smart alec, I spent a decade with sex workers across India,fighting HIV/AIDS, and imbibing life lessons in love, leadership and courage. Its all in my recent book “A STRANGER TRUTH”. AMA (Starting 6 PM IST)",a9o4pq,AMA,ashokchoki2019,https://www.reddit.com/r/india/comments/a9o4pq/hello_reddit_after_several_years_as_a_mckinsey/,55,156,2018-12-26 12:18:12
"Hi reddit, longtime lurker, first ti(m)e poster Imran Khan here. Let's chat.",236bpy,AMA,ImranKhanAMA,https://www.reddit.com/r/india/comments/236bpy/hi_reddit_longtime_lurker_first_time_poster_imran/,861,867,2014-04-16 12:18:48
AMA with SHAKTI team,96xwjg,AMA,shaktiteam,https://www.reddit.com/r/india/comments/96xwjg/ama_with_shakti_team/,93,115,2018-08-13 12:31:10
"We are the mods of /r/India, Ask us anything*",8x9wuu,AMA,root_su,https://www.reddit.com/r/india/comments/8x9wuu/we_are_the_mods_of_rindia_ask_us_anything/,721,86,2018-07-09 09:12:23
"Hey Reddit, I am Atamjeet S Bawa and I sold a T-90 Tank to the Indian Army! Trying to balance between my Passion (Paper Modeling) & my Profession (IBMer)",8k411o,AMA,PaperModelGuru,https://www.reddit.com/r/india/comments/8k411o/hey_reddit_i_am_atamjeet_s_bawa_and_i_sold_a_t90/,103,159,2018-05-17 12:55:32
"AMA - K Vaitheeswaran - Jan 25th, 2020",etpyiu,AMA,Vaitheek,https://www.reddit.com/r/india/comments/etpyiu/ama_k_vaitheeswaran_jan_25th_2020/,44,56,2020-01-25 11:59:44
"This is Arnab Goswami. I am here as promised. Ask me, what Redditors want to know!",67us0c,AMA,Arnab-G,https://www.reddit.com/r/india/comments/67us0c/this_is_arnab_goswami_i_am_here_as_promised_ask/,1312,792,2017-04-27 10:35:56
"I’m Séverine Bardon, a film director and journalist whose documentary ‘India: The Children’s Newspaper” follows a unique newspaper written by and for street children from Delhi’s slums. Want to know about filmmaking and how Balaknama newspaper is changing children’s lives? AMA.",qlurz5,AMA,ARTEinEnglish,https://www.reddit.com/r/india/comments/qlurz5/im_séverine_bardon_a_film_director_and_journalist/,49,246,2021-11-03 13:44:24
Hi r/India Commodore Uday Bhaskar (Retd.) here! Ask Me Anything,plk2cb,AMA,cudayb,https://www.reddit.com/r/india/comments/plk2cb/hi_rindia_commodore_uday_bhaskar_retd_here_ask_me/,105,330,2021-09-10 12:30:04
"Hello /r/India, we are the team from Manzuri. Ask us Anything!",picg9g,AMA,Manzuri_India,https://www.reddit.com/r/india/comments/picg9g/hello_rindia_we_are_the_team_from_manzuri_ask_us/,116,328,2021-09-05 12:45:12
"AMA with Aakar Patel- Writer, Political Commentator, Farishta: Today at 7PM",qzfawi,AMA,ppatra,/r/librandu/comments/qzf3d5/ama_with_aakar_patel_writer_political_commentator/,0,22,2021-11-22 06:48:16
"Reddit Talk AMA with Anushka Jain, Rohin Garg and Krishnesh Bapat from IFF (Internet Freedom Foundation) on digital rights, privacy and more",pgi98g,AMA,msquarea,https://www.reddit.com/r/india/comments/pgi98g/reddit_talk_ama_with_anushka_jain_rohin_garg_and/,8,203,2021-09-02 13:48:46
If you are on Desktop / other reddit apps LIVE AMA with Olympic gold medalist Neeraj Chopra is going on Reddit Talk platform available only on official mobile apps! Download and join now. AMA,pra17a,AMA,ppatra,https://www.reddit.com/r/india/comments/pra17a/if_you_are_on_desktop_other_reddit_apps_live_ama/,9,6,2021-09-19 15:27:31
"Hi r/India, I am Rajesh from Bookish Santa. I am here to talk about online book selling, publishing industry, authors & bestsellers and everything that relates to book and literature in India. AMA !",lbmm6h,AMA,Rajeshkkc,https://www.reddit.com/r/india/comments/lbmm6h/hi_rindia_i_am_rajesh_from_bookish_santa_i_am/,78,259,2021-02-03 12:36:34
"Hi r/India, we are Arushi Garg and Riya Singh. We are here to talk about the ongoing criminal reforms in India. Ask us anything!",jkvn29,AMA,arushigarglaw,https://www.reddit.com/r/india/comments/jkvn29/hi_rindia_we_are_arushi_garg_and_riya_singh_we/,91,427,2020-10-30 12:15:47
Hi! We are Ananya and Sunil from Songdew. We are working to change the independent music industry in India. Ask Us Anything! :),jy97to,AMA,WhoGirlMarketer,https://www.reddit.com/r/india/comments/jy97to/hi_we_are_ananya_and_sunil_from_songdew_we_are/,69,217,2020-11-21 11:23:24
I'm an environmental consultant from Pakistan. AMA!,ju0i9w,AMA,Noobatron1337,https://www.reddit.com/r/india/comments/ju0i9w/im_an_environmental_consultant_from_pakistan_ama/,58,116,2020-11-14 11:20:43
"Hi, I’m Dr. Roshan Radhakrishnan, a doctor, and an avid writer. I am here to answer your queries about Coronavirus and then some more. AMA.",fk649f,AMA,pythoroshan,https://i.redd.it/vf1ak8axs8n41.jpg,396,814,2020-03-17 14:25:19
"Hi Reddit, I am Nakul Singh Sawhney, an independent documentary filmmaker and co-founder of ChalChitra Abhiya›an, Ask Me Anything",iwzbxt,AMA,NakulSS1,https://www.reddit.com/r/india/comments/iwzbxt/hi_reddit_i_am_nakul_singh_sawhney_an_independent/,70,143,2020-09-21 12:21:09
I Am An Aam Aadmi Party MLA. Ask Me Anything!,e4i3vq,AMA,pankajpushkar,https://www.reddit.com/r/india/comments/e4i3vq/i_am_an_aam_aadmi_party_mla_ask_me_anything/,425,1565,2019-12-01 14:30:48
"Hi, I’m Comedian, actor ＆ biscuit lover Vir Das - Ask Me Anything!",ezm2ic,AMA,ComedianVirDas,https://www.reddit.com/r/india/comments/ezm2ic/hi_im_comedian_actor_biscuit_lover_vir_das_ask_me/,452,416,2020-02-06 03:30:43
"Hi Reddit, I am Pratik Sinha, Co-founder of Alt News, Ask Me Anything",ejes3k,AMA,frthnker,https://www.reddit.com/r/india/comments/ejes3k/hi_reddit_i_am_pratik_sinha_cofounder_of_alt_news/,301,1078,2020-01-03 12:28:48
"Hi I'm Ashish Ranjan, national convener of national alliance of people's movements and part of organisation group behind two massive protests against CAA and NRC in Bihar. Ask Me Anything.",ee3636,AMA,ashishnapm,https://www.reddit.com/r/india/comments/ee3636/hi_im_ashish_ranjan_national_convener_of_national/,179,447,2019-12-22 09:38:56
"Hi, I am a SportS Scientist, Performance Psychologist & High-Performance Coach to professional athletes and executives. Shayamal Vallabhjee. This is my AMA Session",hzzvny,AMA,ShayamalVallabhjee,https://www.reddit.com/r/india/comments/hzzvny/hi_i_am_a_sports_scientist_performance/,39,68,2020-07-29 12:31:29
"Hi Reddit! I'm Srinivas Kodali, A independent researcher documenting on Aadhaar and NPR projects. Ask me Anything :)",efg21t,AMA,digitaldutta,https://www.reddit.com/r/india/comments/efg21t/hi_reddit_im_srinivas_kodali_a_independent/,130,371,2019-12-25 12:39:42
"Hi reddit! I'm Rachita, creator of the webcomic Sanitary Panels. Thank you for having me. Ask me anything! :)",ee3wjg,AMA,sanitarypanels,https://www.reddit.com/r/india/comments/ee3wjg/hi_reddit_im_rachita_creator_of_the_webcomic/,131,361,2019-12-22 11:23:44
"Hi Reddit, I'm Aatish Taseer, Ask Me Anything",egctcf,AMA,aatishtaseer,https://www.reddit.com/r/india/comments/egctcf/hi_reddit_im_aatish_taseer_ask_me_anything/,143,259,2019-12-27 15:58:01
"Hey! It's Divya Spandana/Ramya , ASK ME (almost) ANYTHING",ayc4w7,AMA,divyaspandana,https://www.reddit.com/r/india/comments/ayc4w7/hey_its_divya_spandanaramya_ask_me_almost_anything/,549,57,2019-03-07 12:33:23
'Sacred Games' AMA with Vikramditya Motwane and Varun Grover,92lsbe,AMA,vidushak,https://www.reddit.com/r/india/comments/92lsbe/sacred_games_ama_with_vikramditya_motwane_and/,528,294,2018-07-28 12:31:30
"I am Sophie Zhang, FB whistleblower. When I found fake accounts manipulating Indian politics, FB approved their removal - until they discovered that some of them were being ran by a sitting MP. The Lok Sabha is considering asking me to testify, but Reddit gets to go first. Ask me anything.",qo1ol8,AMA,szhang_ds,https://www.reddit.com/r/india/comments/qo1ol8/i_am_sophie_zhang_fb_whistleblower_when_i_found/,540,9369,2021-11-06 14:43:29
"Hey Reddit India ... This is Arunabh Kumar, From TVF, am here.. start emabrassing me with any question",3knoby,AMA,theqtiyapaguy,https://www.reddit.com/r/india/comments/3knoby/hey_reddit_india_this_is_arunabh_kumar_from_tvf/,729,292,2015-09-12 12:29:07
"Hi I'm Prateep Basu, former ISRO Engineer having launched my own startup SatSure which strives to help improve credit and insurance linkages for farmers and help them make better decisions. Ask Me Anything.",7m12z0,AMA,PBasu,https://www.reddit.com/r/india/comments/7m12z0/hi_im_prateep_basu_former_isro_engineer_having/,107,399,2017-12-25 12:07:24
"Hello r/india, we are members of the Bikerni Team that recently completed the ""Road to Mekong Expedition"" riding through India, Myanmar, Thailand, Cambodia, Vietnam & Laos. Ask Us Anything.",8f22nb,AMA,bikerni,https://www.reddit.com/r/india/comments/8f22nb/hello_rindia_we_are_members_of_the_bikerni_team/,77,80,2018-04-26 11:59:52
"I am Jaya, co-founder of a non-profit organization called 'The Story Of' Foundation. I like to make contemporary science and philosophy accessible to all through innovative storytelling. There is nothing like stupid and no one is stupid. AMA!",7aw42p,AMA,JayaRamchandani,https://www.reddit.com/r/india/comments/7aw42p/i_am_jaya_cofounder_of_a_nonprofit_organization/,103,129,2017-11-05 06:31:50
We are Vikramaditya Motwane (director) and Rajkummar Rao (actor) of 'Trapped'! Let's talk.,5ylk64,AMA,vikramaditya_m,https://www.reddit.com/r/india/comments/5ylk64/we_are_vikramaditya_motwane_director_and/,174,131,2017-03-10 11:24:53
"Hey, I am Raghav Mandava, one of the first professional comedians and comedy producers in India. If you don't know me, that's okay, lets talk comedy!",8deqjl,AMA,raghavmandava,https://www.reddit.com/r/india/comments/8deqjl/hey_i_am_raghav_mandava_one_of_the_first/,72,84,2018-04-19 13:45:00
"I cook(though not professionally), will be happy to answer any of your questions regarding cooking to the best of my knowledge, so AMA.",5pa2zu,AMA,an8hu,https://www.reddit.com/r/india/comments/5pa2zu/i_cookthough_not_professionally_will_be_happy_to/,164,143,2017-01-21 10:36:59
"Hello r/india, I am Vijay Shekhar Sharma from Paytm / One97. Ask Me Anything :-)",3v505c,AMA,Vssx,https://www.reddit.com/r/india/comments/3v505c/hello_rindia_i_am_vijay_shekhar_sharma_from_paytm/,348,159,2015-12-02 13:15:10
This is cartoonist Satish Acharya. Ask Me Anything today!,6fsvxa,AMA,cartoonistsatish,https://www.reddit.com/r/india/comments/6fsvxa/this_is_cartoonist_satish_acharya_ask_me_anything/,125,124,2017-06-07 11:44:43
"Hey Reddit! I am Sandeep Goenka, co-founder of Zebpay India Bitcoin Exchange. Ask me anything!",5e3mni,AMA,goenkasandeep,https://www.reddit.com/r/india/comments/5e3mni/hey_reddit_i_am_sandeep_goenka_cofounder_of/,218,94,2016-11-21 11:44:31
"[AMA] Hi r/India! I'm a CA and would love to answer questions you have about finance/economy/taxation, Ask me anything!",5tcgn5,AMA,Cap_Nemo_1984,https://www.reddit.com/r/india/comments/5tcgn5/ama_hi_rindia_im_a_ca_and_would_love_to_answer/,206,74,2017-02-11 05:43:55
"Hi Reddit, i'm Siddharth Agarwal & i'm currently on a walk (3000kms) along the river Ganga from sea to source and i have already walked more than 500kms in one month. AmA!",4saxeh,AMA,iamasid,https://www.reddit.com/r/india/comments/4saxeh/hi_reddit_im_siddharth_agarwal_im_currently_on_a/,147,342,2016-07-11 13:32:51
[NP] I am a dentist. AMA!!!,4giohy,AMA,periomate,https://www.reddit.com/r/india/comments/4giohy/np_i_am_a_dentist_ama/,297,97,2016-04-26 12:58:58
hi this is rajat kapoor- ask me anything!,3csit9,AMA,rajat_rk_kapoor,https://www.reddit.com/r/india/comments/3csit9/hi_this_is_rajat_kapoor_ask_me_anything/,273,305,2015-07-10 12:35:36
"Hi /r/India I'm Rahul daCunha, Ad guy and theatre guy, I create Amul ads every single day of my life",2tyat9,AMA,rahul_dacunha,https://www.reddit.com/r/india/comments/2tyat9/hi_rindia_im_rahul_dacunha_ad_guy_and_theatre_guy/,265,364,2015-01-28 11:09:08
"I am Pranav Dixit, Technology Editor at Hindustan Times, New Delhi. I've been using the Freedom 251, the world's cheapest smartphone for a day. I also attended (and live-tweeted) the phone launch in New Delhi on Wednesday evening. Ask Me Anything!",46drra,AMA,pranav_dixit,https://www.reddit.com/r/india/comments/46drra/i_am_pranav_dixit_technology_editor_at_hindustan/,213,260,2016-02-18 08:16:03
"Hi Reddit, this Ritu Sarin, Vaidyanathan Iyer and Jay Mazoomdar of The Indian Express in Ask Me Anything",4eajgk,AMA,indianexpressweb,https://www.reddit.com/r/india/comments/4eajgk/hi_reddit_this_ritu_sarin_vaidyanathan_iyer_and/,153,383,2016-04-11 12:47:42
"Hey guys, I am Meiyang Chаng, actor, television host, singer and a qualified dentist. AMA!",2wz5q0,AMA,MeiyangChang,https://www.reddit.com/r/india/comments/2wz5q0/hey_guys_i_am_meiyang_chаng_actor_television_host/,313,338,2015-02-24 10:16:36
"Hi Reddit, this is Chetna Gala Sinha from Mann Deshi. Ask me anything",7owz4j,AMA,ChetnaVsinha,https://www.reddit.com/r/india/comments/7owz4j/hi_reddit_this_is_chetna_gala_sinha_from_mann/,57,115,2018-01-08 07:32:32
"Hi Reddit, this is Biswapati Sarkar from TVF. Ask me anything.",4ktjwp,AMA,chhotathalaiva,https://www.reddit.com/r/india/comments/4ktjwp/hi_reddit_this_is_biswapati_sarkar_from_tvf_ask/,208,161,2016-05-24 12:37:00
Welcome to the IndiaExplained AMA!,7cfswn,AMA,rchopses,https://www.reddit.com/r/india/comments/7cfswn/welcome_to_the_indiaexplained_ama/,97,59,2017-11-12 14:58:24
"Hi Reddit, this is Siddharth. Ask me anything",3623qn,AMA,svaradarajan,https://www.reddit.com/r/india/comments/3623qn/hi_reddit_this_is_siddharth_ask_me_anything/,348,178,2015-05-15 13:26:17
"Hi Reddit, I am Gurpreet Singh, goalkeeper for Norwegian club Stabæk in Tippeligaen. Ask Me Anything!",30dewy,AMA,GurpreetSinghAMA,https://www.reddit.com/r/india/comments/30dewy/hi_reddit_i_am_gurpreet_singh_goalkeeper_for/,225,394,2015-03-26 13:56:24
"I did my Engineering/Jail term in Sairam engineering college, Chennai. AMA.",3lrnqt,AMA,sairam_alumni,https://www.reddit.com/r/india/comments/3lrnqt/i_did_my_engineeringjail_term_in_sairam/,341,290,2015-09-21 05:04:42
"Hi! I'm Jairaj Devadiga, economist, and columnist at the Foundation for Economic Education. Ask Me Anything.",7oyscz,AMA,JairajDevadiga,https://www.reddit.com/r/india/comments/7oyscz/hi_im_jairaj_devadiga_economist_and_columnist_at/,175,120,2018-01-08 14:20:11
"Hi r/india, I am a commercial pilot for a major airline. Ask me anything.",52q9tm,AMA,iceman_dfw,https://www.reddit.com/r/india/comments/52q9tm/hi_rindia_i_am_a_commercial_pilot_for_a_major/,212,191,2016-09-14 12:42:43
"Hi reddit, we are Parvaaz from Bangalore. Ask us anything.",6bvyff,AMA,parvaaz,https://www.reddit.com/r/india/comments/6bvyff/hi_reddit_we_are_parvaaz_from_bangalore_ask_us/,231,81,2017-05-18 12:48:30
We are three ISRO scientists here to answer your questions -AMA,1ujcmo,AMA,ISROredditors,https://www.reddit.com/r/india/comments/1ujcmo/we_are_three_isro_scientists_here_to_answer_your/,802,1044,2014-01-06 13:45:49
I am a dentist and I have some time. AMA!,5lxx9i,AMA,doc_two_thirty,https://www.reddit.com/r/india/comments/5lxx9i/i_am_a_dentist_and_i_have_some_time_ama/,398,136,2017-01-04 08:04:07
"Hi I’m Rahul Yadav, CEO of Housing.com, AMA!",36hezf,AMA,rahul_housing,https://www.reddit.com/r/india/comments/36hezf/hi_im_rahul_yadav_ceo_of_housingcom_ama/,708,363,2015-05-19 12:23:31
Hello reddit! I am Kalki Koechlin. AMA!,49i93f,AMA,kalkikoechlin,https://www.reddit.com/r/india/comments/49i93f/hello_reddit_i_am_kalki_koechlin_ama/,375,478,2016-03-08 12:22:33
"Hello r/india. We are u/mentalhealthind, an NGO working to create knowledge and awareness around mental health and wellbeing. Ask us anything.",87qxlo,AMA,mentalhealthind,https://www.reddit.com/r/india/comments/87qxlo/hello_rindia_we_are_umentalhealthind_an_ngo/,94,179,2018-03-28 10:50:18
"Hey Reddit, I'm Anoop Bhat. I draw stuff in pen and ink for bands from around the world (Opeth, Anathema, Parvaaz). AMA!",84lr68,AMA,scourgwreck,https://www.reddit.com/r/india/comments/84lr68/hey_reddit_im_anoop_bhat_i_draw_stuff_in_pen_and/,103,145,2018-03-15 11:32:47
I'm an IPL cheerleader AMA,351s7f,AMA,IPLcheer,https://www.reddit.com/r/india/comments/351s7f/im_an_ipl_cheerleader_ama/,527,501,2015-05-06 11:53:46
"I am Ashish K. Mishra, I write stories. AMA",76xx01,AMA,Akm1410,https://www.reddit.com/r/india/comments/76xx01/i_am_ashish_k_mishra_i_write_stories_ama/,208,75,2017-10-17 11:29:02
AMA #SaveOurPrivacy,99n492,AMA,SaveOurPrivacy,https://www.reddit.com/r/india/comments/99n492/ama_saveourprivacy/,66,98,2018-08-23 12:52:37
We ISRO scientists are back to answer more of your questions - AMA,3yispw,AMA,ISROredditors,https://www.reddit.com/r/india/comments/3yispw/we_isro_scientists_are_back_to_answer_more_of/,354,373,2015-12-28 13:38:23
"Hello Reddit; we are students at IIT Indore, currently in protest against the administration. Ask us anything!",7vw2s8,AMA,CallForHelp_STUD,https://www.reddit.com/r/india/comments/7vw2s8/hello_reddit_we_are_students_at_iit_indore/,73,248,2018-02-07 13:28:39
"Hi, I’m Swati - CoFounder of CashKaro.com - Ask Me Anything about Entrepreneurship, Cashback model/industry & more!",6rk5x5,AMA,Swati_CK,https://www.reddit.com/r/india/comments/6rk5x5/hi_im_swati_cofounder_of_cashkarocom_ask_me/,212,107,2017-08-04 12:33:49
"Hey r/India! I'm a manager at a major player in the broadcast industry and would love to answer questions you have about TV ratings, HD, SD, GECs, Sports, etc. Ask Me Anything",5u5tve,AMA,hopelessray,https://www.reddit.com/r/india/comments/5u5tve/hey_rindia_im_a_manager_at_a_major_player_in_the/,355,81,2017-02-15 06:18:37
"I work in HR! AMA about HR, companies and career trends",5oonhf,AMA,batatavada,https://www.reddit.com/r/india/comments/5oonhf/i_work_in_hr_ama_about_hr_companies_and_career/,339,94,2017-01-18 10:34:28
"[R]Hello r/india, I am a Kashmiri Pandit, with my parents, and they were driven out of Kashmir in January 1990. Ask Us Anything about that night and time!",41jqu1,AMA,suckerpunch12343,https://www.reddit.com/r/india/comments/41jqu1/rhello_rindia_i_am_a_kashmiri_pandit_with_my/,293,427,2016-01-18 16:48:24
"We are Rahul and Nikhil from Indian Ocean, Ask Us Anything",6dtand,AMA,NikhilRaoIO,https://www.reddit.com/r/india/comments/6dtand/we_are_rahul_and_nikhil_from_indian_ocean_ask_us/,157,179,2017-05-28 11:17:12
"Hello /r/India, I am Tathagata Satpathy. Member of Parliament, Chief Whip of BJD, Editor of Dharitri & Orissa POST. AMA!",2z493l,AMA,tathagatasatpathy,https://www.reddit.com/r/india/comments/2z493l/hello_rindia_i_am_tathagata_satpathy_member_of/,347,635,2015-03-15 12:30:44
"Hey. This is Richa Chadha (actor- Masaan, Fukrey, GoW, etc.). I'm here to answer any questions you may have. AMA!",3f9vk3,AMA,richachadha,https://www.reddit.com/r/india/comments/3f9vk3/hey_this_is_richa_chadha_actor_masaan_fukrey_gow/,401,375,2015-07-31 10:21:19
"Hello Reddit, I'm Aakash Mehta AKA KuchBhiMehta AKA Mangesh. Ask Me Anything!",852xds,AMA,thekuchbhimehta,https://www.reddit.com/r/india/comments/852xds/hello_reddit_im_aakash_mehta_aka_kuchbhimehta_aka/,102,76,2018-03-17 10:21:44
[AMA ] We are Nodding Heads Games! The studio behind Indie Action Adventure Game Raji. The game is based on Indian Mythology. 6 PM to 8PM IST!,7dc49r,AMA,NoddingHeadsGames,https://www.reddit.com/r/india/comments/7dc49r/ama_we_are_nodding_heads_games_the_studio_behind/,103,144,2017-11-16 12:40:23
"Hi, this is Social Media Hoax Slayer, Ask Me anything",6ktdm8,AMA,SMHoaxSlayer,https://www.reddit.com/r/india/comments/6ktdm8/hi_this_is_social_media_hoax_slayer_ask_me/,147,158,2017-07-02 14:03:24
"Hi, I'm Deepinder Goyal, Founder and CEO of Zomato. Ask me anything!",2yo614,AMA,deepigoyal,https://www.reddit.com/r/india/comments/2yo614/hi_im_deepinder_goyal_founder_and_ceo_of_zomato/,508,193,2015-03-11 12:27:47
"Hello r/india I am an Assistant Commandant in CoBRA Special force, with experience in counter insurgency. Currently serving as an outdoor and combat conditioning trainer with the COBRA. Ask me (almost) anything.",4tl8jn,AMA,shailuACcobra,https://www.reddit.com/r/india/comments/4tl8jn/hello_rindia_i_am_an_assistant_commandant_in/,179,166,2016-07-19 13:55:38
"Indians above 25, what do you regret the most?",rtlplc,AskIndia,anonman369,https://www.reddit.com/r/india/comments/rtlplc/indians_above_25_what_do_you_regret_the_most/,1199,2854,2022-01-01 15:37:51
How do you live knowing you're going to be a loser for the rest of your life?,s0er0r,AskIndia,Twinkfiddler2001,https://www.reddit.com/r/india/comments/s0er0r/how_do_you_live_knowing_youre_going_to_be_a_loser/,114,108,2022-01-10 07:59:43
Hey India: What did you have for Dinner tonight?,r9i1d3,AskIndia,-GandalfTheGay,https://www.reddit.com/r/india/comments/r9i1d3/hey_india_what_did_you_have_for_dinner_tonight/,782,997,2021-12-05 15:28:45
"Seriously, what's wrong with Telugu cinema?",rijf4n,AskIndia,notmanydips,https://www.reddit.com/r/india/comments/rijf4n/seriously_whats_wrong_with_telugu_cinema/,348,940,2021-12-17 15:08:01
