title,id,flair,author,url,num_comments,score,timestamp
Watch: India Successfully Tests 'Pralay' Missile. Has Ability To Change Path Midair,rmnnv9,Science/Technology,myflowergift07,https://www.ndtv.com/india-news/india-successfully-tests-pralay-missile-off-odisha-coast-2664670,25,112,2021-12-23 04:59:46
"[OLD] Indians should focus on education and technology, not meat: Nobel laureate Venkatraman Ramakrishnan",rk4z78,Science/Technology,NearbyMitron,https://scroll.in/latest/850987/indians-should-focus-on-education-and-technology-not-meat-nobel-laureate-venkatraman-ramakrishnan,12,155,2021-12-19 20:28:07
Govt Says Syllabus Outline Drafted To Integrate ‘Ayush Knowledge’ Into School Curriculum,r6zluf,Science/Technology,Scientifichuman,https://www.reddit.com/r/india/comments/r6zluf/govt_says_syllabus_outline_drafted_to_integrate/,44,131,2021-12-02 05:12:33
Kumbalangi in Kerala to be first sanitary napkin free village in India - India News,s3hphd,Science/Technology,doAnkhenBaraHaath,https://www.indiatoday.in/india/story/kumbalanghi-in-kerala-to-be-first-sanitary-napkin-free-village-in-india-1899495-2022-01-13,3,75,2022-01-14 03:11:44
KBC withdraws episode after a rationalist writes to them about the Pseudo-science they were spreading in that episode.,r5r80w,Science/Technology,Scientifichuman,https://www.newindianexpress.com/nation/2021/nov/30/amitabh-bachchan-gets-open-letter-from-rationalist-kbc-pulls-out-super-power-episode-2389721.html,29,272,2021-11-30 16:35:57
"India has told Starlink, which is yet to get a licence, to refund clients and refrain from fresh orders",rwhe9z,Science/Technology,Impressive-Nose9110,https://www.aljazeera.com/economy/2022/1/5/elon-musks-starlink-hits-a-wall-in-india,9,24,2022-01-05 07:44:47
How did India achieve such software engineering competence?,rtgide,Science/Technology,drmanhadan,https://www.reddit.com/r/india/comments/rtgide/how_did_india_achieve_such_software_engineering/,26,5,2022-01-01 10:08:07
Should I buy Macbook or upgrade to SSD in old Laptop? Also what are iPad usage apart from Media Consumption?,s0rprd,Science/Technology,the_introvert_weeb,https://www.reddit.com/r/india/comments/s0rprd/should_i_buy_macbook_or_upgrade_to_ssd_in_old/,11,6,2022-01-10 19:06:01
India Must Immediately Develop Hypersonic Cruise Missiles: Defence Minister Rajnath Singh,rgc89w,Science/Technology,badbola,https://www.ndtv.com/india-news/india-must-immediately-develop-hypersonic-cruise-missiles-defence-minister-rajnath-singh-2650479,17,7,2021-12-14 17:15:54
"Those who studied in Homeopathic Medical Colleges, did you ever find the basic premise of Homeopathy baseless? Did you ever want to change careers?",ri6z87,Science/Technology,deanstag,https://www.reddit.com/r/india/comments/ri6z87/those_who_studied_in_homeopathic_medical_colleges/,370,910,2021-12-17 02:39:43
"Linux users of India, what is your favourite distro??",rsl3jb,Science/Technology,ChinuCODM,https://www.reddit.com/r/india/comments/rsl3jb/linux_users_of_india_what_is_your_favourite_distro/,322,426,2021-12-31 04:13:15
January issue of Resonance magazine – Journal of Science Education | Indian Academy of Sciences (Free to Read Online/Download),s2tafa,Science/Technology,paradoxonium,https://www.ias.ac.in/listing/articles/reso/027/01,3,1,2022-01-13 07:06:53
Misinformation: Last Week Tonight with John Oliver | John calls out the deluge of misinformation on Indian WhatsApp Groups,q5tf11,Science/Technology,bhodrolok,https://www.youtube.com/watch?v=l5jtFqWq5iU,52,419,2021-10-11 11:02:59
Need help with my iPhone,rz6cx5,Science/Technology,curious_mofo1,https://www.reddit.com/r/india/comments/rz6cx5/need_help_with_my_iphone/,3,2,2022-01-08 18:27:55
Which is a good tablet to use with a keyboard under 15000?,rv25lu,Science/Technology,eager_tobuy,https://www.reddit.com/r/india/comments/rv25lu/which_is_a_good_tablet_to_use_with_a_keyboard/,4,2,2022-01-03 13:50:51
Forbes India - Climate Rapidly Becoming One Of The Biggest Wealth-creation Opportunities Of All Times: Anshuman Bapna,rxd8xz,Science/Technology,BhaswatiGuha19,https://www.forbesindia.com/article/new-year-special-2022/climate-rapidly-becoming-one-of-the-biggest-wealthcreation-opportunities-of-all-times-ansuman-bapna/72773/1,0,17,2022-01-06 12:16:52
"Around the world, people are getting taller – so why are Indian heights on the decline?",pyeaue,Science/Technology,slimshayedy,https://scroll.in/article/1006468/around-the-world-people-are-getting-taller-so-why-are-indian-heights-on-the-decline,106,248,2021-09-30 06:47:13
Is Crucial P1 good for daily multitasking?,ro51qy,Science/Technology,Sol_46,https://www.reddit.com/r/india/comments/ro51qy/is_crucial_p1_good_for_daily_multitasking/,8,2,2021-12-25 07:30:56
"India successfully tests Agni V nuclear capable ballistic missile with 5,000 km range.",qgz9so,Science/Technology,One-Climate-6996,https://www.ndtv.com/india-news/agni-v-ballistic-missile-with-5-000-km-range-successfully-tested-2590136#pfrom=home-ndtv_topscroll,33,138,2021-10-27 15:28:43
This is my induction stove. What does the 120 signify ?,rsve35,Science/Technology,Gammaconvex,https://i.redd.it/ct5mw5nr4w881.jpg,3,7,2021-12-31 14:45:22
"Elon Musk’s Starlink Net service has no licence, shun it: Govt to Public",r4p1ru,Science/Technology,Set1Less,https://timesofindia.indiatimes.com/business/india-business/elon-musks-starlink-net-service-has-no-licence-shun-it-govt-to-public/articleshow/87970014.cms,12,25,2021-11-29 06:02:21
Need suggestions for a < 13k phone for my dad,rbn02u,Science/Technology,thugz_doge,https://www.reddit.com/r/india/comments/rbn02u/need_suggestions_for_a_13k_phone_for_my_dad/,16,6,2021-12-08 08:53:21
"SNK Metal Slug Dragon Nosuke - 3d modeling by Artforge, 2022",s563ti,Science/Technology,Artforge756,https://www.youtube.com/watch?v=bCfvPPs-oH8&t=805s,0,4,2022-01-16 07:01:53
Any log4j war stories here?,rizhqu,Science/Technology,plshelpthedog,https://www.reddit.com/r/india/comments/rizhqu/any_log4j_war_stories_here/,6,7,2021-12-18 04:37:36
"@PMOIndia: The greatest product of technology today is data. In India, we have created a robust framework of data protection, privacy and security. And, at the same time, we use data as a source of empowerment of people: PM @narendramodi",qwhsu6,Science/Technology,GobhiHaiToPumpkinHai,https://twitter.com/PMOIndia/status/1461179163486797834?t=5glkOQrMXKM5FUx6l_6u2w&s=09,20,38,2021-11-18 04:36:46
I got these messages even though I've never heard of Watcho in my life. Should I be concerned?,rj1bj9,Science/Technology,lordvoldybuff,https://www.reddit.com/gallery/rj1bj9,6,8,2021-12-18 06:27:23
"This week in the Console newsletter we interviewed Kovid, an Indian developer and the creator of Kitty! Kitty is a cross-platform, fast, feature-rich, GPU based terminal. We talked about why a GPU is useful for terminals. I thought /r/india might be interested in reading the interview! :)",s5gl5j,Science/Technology,binaryfor,https://console.substack.com/p/console-88?r=3cbez&utm_campaign=india_subreddit&utm_medium=india_subreddit,0,3,2022-01-16 17:22:44
Mining Open Data to Discover Previously Unknown Information,rmu5qw,Science/Technology,Impressive-County223,https://www.reddit.com/r/india/comments/rmu5qw/mining_open_data_to_discover_previously_unknown/,2,29,2021-12-23 11:57:42
i am getting a network error message whenever i am tring to play games like valorant and on fortnight but when i am running telrik fiddler software in the background the games are running but recently i got a permarent ban from valorant the game is not opening without the fiddler,s4honv,Science/Technology,Possible_Monitor2836,https://www.reddit.com/r/india/comments/s4honv/i_am_getting_a_network_error_message_whenever_i/,2,0,2022-01-15 10:39:46
I didn't know Indian data scientist salaries are this low compared to US,qdyohg,Science/Technology,plshelpthedog,https://i.redd.it/m6rzqi9yy4v71.png,40,133,2021-10-23 05:33:32
TIL that Nokia Purebook laptops which are available for sale in Flipkart website in India are not actually made by Nokia.,qvrpw8,Science/Technology,musiczlife,https://i.redd.it/8mg4a39ea3081.png,19,31,2021-11-17 05:12:49
India has a long road ahead if her in terms of science contribution,rv6z1u,Science/Technology,wet_tongue,https://www.reddit.com/r/india/comments/rv6z1u/india_has_a_long_road_ahead_if_her_in_terms_of/,3,2,2022-01-03 17:27:36
Blood test can predict harmful pregnancy complication in advance,s2sayx,Science/Technology,paradoxonium,https://www.nature.com/articles/d44151-022-00001-z,1,13,2022-01-13 06:10:26
"Spotify not working on Airtel Xstream fibre, it's saying no internet connection but internet is working fine with other apps, as soon as i switch to my Jio sim it works normally, anyone else facing issue with Airtel?",s0jcbh,Science/Technology,guntassinghIN,https://i.redd.it/41gro7ghxua81.jpg,4,1,2022-01-10 12:51:12
"Microsoft Kaizala: Definitely, some Maharashtrian came up with this name :D (""Kai Zala?"" means ""What happened?"" in Marathi; predominant language from Maharashtra, India)",rztayx,Science/Technology,nikditt,https://i.redd.it/6sufmwr4eoa81.jpg,4,0,2022-01-09 14:52:51
"To The Point : Dr S Somanath, former Director, VSSC, ISRO (Now he is Chairman on ISRO)",s5mq1v,Science/Technology,meekaa_saangoo,https://www.youtube.com/watch?v=7EcnctjJmN4,0,7,2022-01-16 21:56:44
"Big B gets open letter from rationalist, KBC pulls out ‘super power’ episode: Popular entertainment channel Sony TV has pulled down its Kaun Banega Crorepati episode on ‘Midbrain Activation’ from all platforms.",r5d91i,Science/Technology,naveen_reloaded,https://www.newindianexpress.com/nation/2021/nov/30/big-b-gets-open-letter-from-rationalist-kbc-pulls-out-super-power-episode-2389721.html,11,63,2021-11-30 03:12:56
Indian Army launches in-house messaging solution ASIGMA,ro3zyw,Science/Technology,thelielmao,https://www.etvbharat.com/english/national/bharat/indian-army-launches-in-house-messaging-solution-asigma/na20211223192829249,6,10,2021-12-25 06:17:21
"Engineers here,how do you study for an exam if the professor who is taking this course is completely new & recently joined the university? As a result you can't find out his exam formats by looking at his past exams.",rvun4u,Science/Technology,Either-Progress9038,https://www.reddit.com/r/india/comments/rvun4u/engineers_herehow_do_you_study_for_an_exam_if_the/,8,0,2022-01-04 13:41:12
"WhatsApp, Facebook and Instagram down for users: Report",q188re,Science/Technology,anwertarique,https://newsd.in/whatsapp-facebook-and-instagram-down-for-users-report/,116,378,2021-10-04 15:55:32
Uranium in groundwater in Karnataka villages: Study,rf5jiw,Science/Technology,El_Impresionante,https://www.deccanherald.com/state/top-karnataka-stories/uranium-in-groundwater-in-karnataka-villages-study-1060227.html,6,37,2021-12-13 03:06:07
"UP Govt Website Shows Poets' 'Allahabadi' Surname Changed to 'Prayagraj', Officials Blame Hackers",rr4itp,Science/Technology,madamplease,https://thewire.in/government/up-govt-website-shows-poets-allahabadi-surname-changed-to-prayagraj-officials-blame-hackers,2,47,2021-12-29 09:49:52
Dumb TV recommendation,rwnems,Science/Technology,MasterpieceOver5510,https://www.reddit.com/r/india/comments/rwnems/dumb_tv_recommendation/,4,5,2022-01-05 13:53:17
In ear bluetooth headphone recommendations without the silicone bit on the top please?,roiju6,Science/Technology,Hopeful-Giraffe-8971,https://www.reddit.com/r/india/comments/roiju6/in_ear_bluetooth_headphone_recommendations/,6,7,2021-12-25 22:08:21
India Successfully Testfires Nuclear Capable Strategic Agni Prime Missile,rj4w3i,Science/Technology,myflowergift07,https://www.ndtv.com/india-news/india-successfully-testfires-nuclear-capable-strategic-agni-prime-missile-2658072,5,27,2021-12-18 10:37:29
Air pollutions in Delhi and Chennai respectively. Today is the worst day for air quality in the last two years. Anyone know why this has happened specifically today? Curious...,qmn5rf,Science/Technology,morningcould,https://www.reddit.com/gallery/qmn5rf,49,61,2021-11-04 15:31:30
"Contestant on Shark Tank India claims to train kids to ""sense"" objects blindfolded and read serial numbers on notes?",s1dwnp,Science/Technology,ug_unb,https://v.redd.it/q7s9ywfph2b81,82,188,2022-01-11 14:17:44
Episode 14: How India's fossil treasures are turning to dust | Podcast from 28 December 2021,s4fyq9,Science/Technology,paradoxonium,https://www.nature.com/articles/d44151-021-00083-1,1,12,2022-01-15 08:41:51
Is there any way to check if any Indian ISPs have blocked my website?,rqifn4,Science/Technology,googol2000,https://www.reddit.com/r/india/comments/rqifn4/is_there_any_way_to_check_if_any_indian_isps_have/,6,4,2021-12-28 15:33:36
India to introduce e-passport. How will the chip-based passport work?,s5yj45,Science/Technology,voilaboiler,https://www.livemint.com/news/india/india-to-introduce-e-passport-how-will-the-chip-based-passport-work/amp-11642320433691.html,2,2,2022-01-17 07:54:27
"From auto-rickshaws to cars, all vehicles will run on ethanol soon: Gadkari | Gadkari had recently said that the government will soon come up with an advisory on flex engines for automobile makers that will allow the manufacture of vehicles that would run both on petrol and 100% ethanol",ror103,Science/Technology,AAPkeMoohMe,https://www.livemint.com/news/india/from-auto-rickshaws-to-cars-all-vehicles-will-run-on-ethanol-soon-gadkari-11640364181218.html,6,5,2021-12-26 06:19:43
India: Hyderabad ‘on the brink of becoming a total surveillance city’,qqmzdh,Science/Technology,myspagat,https://www.amnesty.org/en/latest/news/2021/11/india-hyderabad-on-the-brink-of-becoming-a-total-surveillance-city/,17,152,2021-11-10 05:21:26
Chandigarh-based startup is helping revolutionise judicial system in India,rjx1zo,Science/Technology,Turbo0801,https://www.msn.com/en-in/money/news/how-a-chandigarh-based-startup-is-helping-revolutionise-judicial-system-in-india/ar-AARXDNu?ocid=msedgntp,7,10,2021-12-19 13:45:18
Best PSU post-purchase warranty service in India (Your experiences)?,rel7h5,Science/Technology,oschannel,https://www.reddit.com/r/india/comments/rel7h5/best_psu_postpurchase_warranty_service_in_india/,12,9,2021-12-12 09:05:13
"Sleeping after midnight is bad for your health, so is going to bed before 10pm, finds study",qnruhn,Science/Technology,Free_Physics,https://theprint.in/health/sleeping-after-midnight-is-bad-for-your-health-so-is-going-to-bed-before-10pm-finds-study/607899/,34,93,2021-11-06 03:32:06
"'RIP Science': Govt Sprays Water in Yamuna to Curb Toxic Foam, Twitter Reacts",qqsdjq,Science/Technology,BhaswatiGuha19,https://www.thequint.com/neon/social-buzz/govt-sprays-water-in-yamuna-to-curb-toxic-foam-twitter-reacts,18,144,2021-11-10 11:31:10
Want to know about IITs,r385dv,Science/Technology,Mother_Cell_7128,https://www.reddit.com/r/india/comments/r385dv/want_to_know_about_iits/,26,14,2021-11-27 07:19:55
How do law enforcement agencies access whatsapp chats for a case? (from a technical perspective),r3fh4e,Science/Technology,phantom_97,https://www.reddit.com/r/india/comments/r3fh4e/how_do_law_enforcement_agencies_access_whatsapp/,17,21,2021-11-27 15:11:54
How to get out of India,ruwo5o,Science/Technology,Atorpidguy,https://www.reddit.com/r/india/comments/ruwo5o/how_to_get_out_of_india/,6,1,2022-01-03 08:11:16
Virat Kohli gives up Test Captaincy!,s4ketz,Sports,Gray_Jedi_1,https://i.redd.it/4qqagvdjtub81.jpg,166,718,2022-01-15 13:33:04
India's 16-year-old Tasnim Mir becomes World Rank 1 in junior badminton women's singles!,s2brq5,Sports,Orange2218,https://i.redd.it/95lx1hiskab81.png,25,1532,2022-01-12 17:28:30
"Just saw 83, fabulous movie.",rnrksc,Sports,AdityaGutpa,https://www.reddit.com/r/india/comments/rnrksc/just_saw_83_fabulous_movie/,2,5,2021-12-24 18:08:19
"After 7 years, Virat Kohli steps down as India's Test captain",s4klkh,Sports,HopeWinsAlways,https://newsable.asianetnews.com/cricket-sports/after-7-years-virat-kohli-steps-down-as-india-s-test-captain-r5r765,2,69,2022-01-15 13:43:37
India knocked out of T20 World cup.,qope8d,Sports,Sensitive_Camera2368,https://www.espncricinfo.com/series/icc-men-s-t20-world-cup-2021-22-1267897/afghanistan-vs-new-zealand-40th-match-group-2-1273751/match-report,105,222,2021-11-07 14:15:40
Jharkhand shooting champion dies by suicide in Bengal; fourth Indian shooter in four months,rhu10g,Sports,sidch95,https://www.hindustantimes.com/india-news/jharkhand-shooting-champion-dies-by-suicide-in-bengal-fourth-indian-shooter-in-four-months-101639657906464.html,13,100,2021-12-16 16:15:42
Video Shows BJP MP Slapping Wrestler On Stage At Sports Event,rj2r1v,Sports,deshdrohi20,https://www.ndtv.com/india-news/video-shows-bjp-mp-brijbhushan-sharan-singh-slapping-wrestler-on-stage-at-sports-event-2658062,15,51,2021-12-18 08:03:59
Chirag Shetty and Satwiksairaj Rankireddy win India Open Men's Doubles title!,s5b0g5,Sports,Orange2218,https://i.redd.it/ds6yp2r8o1c81.png,1,167,2022-01-16 12:35:54
"Kashmir's TAJAMUL ISLAM Makes India Proud, Wins Gold In World Kickboxing Champion For 2nd Times.",qiixto,Sports,Better__name,https://i.imgur.com/W8zLrhl.jpg,51,1604,2021-10-29 18:17:05
Lakshya Sen enters the finals of India Open. He'll face the reigning world champion in the finals!,s4marb,Sports,Orange2218,https://i.redd.it/issvnpqvavb81.png,2,43,2022-01-15 15:10:20
meanwhile,qfajvr,Sports,sudden_dust,https://i.redd.it/jpkgahowhjv71.jpg,69,981,2021-10-25 06:22:07
India at Olympics 2020: Day 15,oz86n2,Sports,puppuli,https://www.reddit.com/r/india/comments/oz86n2/india_at_olympics_2020_day_15/,4150,268,2021-08-06 14:51:39
What's happening in Indian Shooting team?,ridzqe,Sports,razorpsycho,https://www.reddit.com/r/india/comments/ridzqe/whats_happening_in_indian_shooting_team/,10,81,2021-12-17 09:47:03
Megathread: ICC Men's T20 World: India v. Pakistan,qemdit,Sports,freddledgruntbugly,https://www.reddit.com/r/india/comments/qemdit/megathread_icc_mens_t20_world_india_v_pakistan/,187,111,2021-10-24 06:16:04
El Clasico,s2ck01,Sports,Arabinda07,https://www.reddit.com/r/india/comments/s2ck01/el_clasico/,3,9,2022-01-12 18:00:48
When will I get equal rights? : Padma Shri Virender Singh reiterates his demand to recognise deaf sportspersons,s4s2sx,Sports,sidch95,https://www.aninews.in/news/national/general-news/when-will-i-get-equal-rights-padma-shri-virender-singh-reiterates-his-demand-to-recognise-deaf-sportspersons20220116001618,0,48,2022-01-15 19:29:13
"From the archives: Sunil Gavaskar, the constant in a hurrying world - He taught Indian cricket to compete, ushering in self-belief. Before his arrival, India had plenty of talent but also plenty of pusillanimity",s29zbu,Sports,mubukugrappa,https://www.indiatoday.in/india-today-insight/story/from-the-archives-sunil-gavaskar-the-constant-in-a-hurrying-world-1895154-2022-01-02,2,18,2022-01-12 16:13:44
"Faridkot: 17-year-old international shooter, who won multiple medals, dies by suicide | Cities News,The Indian Express",rcxyx6,Sports,k3times,https://indianexpress.com/article/cities/chandigarh/faridkot-17-year-old-international-shooter-who-won-multiple-medals-dies-by-suicide-7665158/,9,85,2021-12-10 02:35:37
Lakshya Sen: Enjoy the last 3 points in Q/F of BWF World Championships 2021,rj9c1s,Sports,laylowmerry,https://v.redd.it/us904iwlgb681,5,79,2021-12-18 15:07:09
"After a long thrilling match, Sindhu defeats WR 3 Yamaguchi to enter the finale of the World Tour Finals!",r8ofma,Sports,Orange2218,https://i.redd.it/lfgm8udqoi381.png,7,251,2021-12-04 12:11:46
CS Santosh’s recovery after Dakar 2021 horror accident,s3qz2q,Sports,Ohsin,https://www.youtube.com/watch?v=MWl1GpJ5AOo,2,10,2022-01-14 12:14:04
"For 40,000 Years DNA Of All People In India Has Been Same: RSS Chief",rjqnt8,Sports,--5-,https://www.ndtv.com/india-news/rss-chief-mohan-bhagwat-for-40-000-years-dna-of-all-people-in-india-has-been-same-2659194,12,8,2021-12-19 06:21:43
How india easily can win thousands of Olympic gold medals,rrbc5t,Sports,sunny-grande,https://www.reddit.com/r/india/comments/rrbc5t/how_india_easily_can_win_thousands_of_olympic/,19,0,2021-12-29 15:56:58
National-level shooter Konica Layak dies by suicide in Kolkata,rhvox1,Sports,GL4389,https://www.deccanherald.com/national/national-level-shooter-konica-layak-dies-by-suicide-in-kolkata-1061602.html,7,36,2021-12-16 17:34:27
India wins the U19 Asia Cup!,rswko4,Sports,economicus00,https://i.redd.it/jn0fjd92fw881.jpg,6,66,2021-12-31 15:43:08
India at Olympics 2020: Day 14,oylupk,Sports,puppuli,https://www.reddit.com/r/india/comments/oylupk/india_at_olympics_2020_day_14/,2545,127,2021-08-05 16:20:46
"A new statue of footballing superstar Cristiano Ronaldo has sparked controversy in the Indian state of Goa, with residents objecting to a Portuguese footballer being honoured instead of a player from India. Thoughts?",rry2y4,Sports,team_NITL,https://www.reddit.com/r/india/comments/rry2y4/a_new_statue_of_footballing_superstar_cristiano/,14,17,2021-12-30 09:51:25
P. V. Sindhu finishes as runner-up at the World Tour Finals!,r9e5kh,Sports,Orange2218,https://i.redd.it/sk3j5yl1qp381.png,18,408,2021-12-05 11:51:38
"Statue of Cristiano Ronaldo is unveiled in INDIA 'to inspire young boys and girls', as critics question why the state of Goa needs a £12,000 65-STONE tribute to a footballer from 5,700 miles away",rrhu3y,Sports,Impressive-Nose9110,https://www.dailymail.co.uk/sport/sportsnews/article-10352555/Cristiano-Ronaldo-12-000-65-stone-statue-unveiled-India.html,95,238,2021-12-29 20:29:00
New IPL Team | MANJUL,qgmeoq,Sports,MANJULtoons,https://i.redd.it/7a655h3mlwv71.png,16,107,2021-10-27 02:26:44
"""Shame on you Jay Shah & Ganguly"": Fans lash out at two most powerful BCCI officials after Virat Kohli makes shocking announcement",s4pynu,Sports,Dwight_Kramer,https://www.jantakareporter.com/india/shame-on-you-jay-shah-ganguly-fans-lash-out-at-two-most-powerful-bcci-officials-after-virat-kohli-makes-shocking-announcement/391997/,32,120,2022-01-15 17:56:13
PV Sindhu 7th highest-paid female athlete of 2021: Forbes,s3vske,Sports,Orange2218,https://thebridge.in/badminton/sindhu-7th-highest-paid-2021-forbes-28325,31,48,2022-01-14 16:02:39
Happy Birthday Viswanathan Anand!,rdvz3c,Sports,ZombieGombie,https://i.redd.it/hnnq6a6xqv481.jpg,50,1513,2021-12-11 09:11:14
Hyderabad all set to host Formula E,s5wowf,Sports,Daggy1234,http://www.deccanchronicle.com/nation/in-other-news/160122/hyderabad-all-set-to-host-formula-e.html,18,46,2022-01-17 06:04:05
Running Advice,s5d4b9,Sports,11kush,https://www.reddit.com/r/india/comments/s5d4b9/running_advice/,30,14,2022-01-16 14:35:40
TATA to replace VIVO as IPL title sponsor next year: IPL Chairman Brijesh Patel to ANI,s18muu,Sports,WhiteShirttBlueJeans,https://twitter.com/ANI/status/1480824656986734597?t=IURaCQn3RhCuEgVFLIgyRg&s=19,15,88,2022-01-11 08:58:44
Dishonesty in Kabir Khan's 83 stems from its desperate need to cater to cricket fans of the 'Virat Kohli era',rqht11,Sports,mubukugrappa,https://www.firstpost.com/entertainment/bollywood/dishonesty-in-kabir-khans-83-stems-from-its-desperate-need-to-cater-to-cricket-fans-of-the-virat-kohli-era-10237961.html,32,107,2021-12-28 15:04:02
In light of the recent tournament...,qq27v7,Sports,dr_ipaka,https://i.redd.it/lhh8q0937ky71.jpg,115,2768,2021-11-09 12:03:57
Srikanth Kidambi defeats Lakshya Sen in an intense semifinal to become the first Indian male to enter the finals of Badminton World Championships!,rjpvj0,Sports,Orange2218,https://i.redd.it/rq2nswg6rf681.png,18,714,2021-12-19 05:32:30
Jehan Daruvala finshes 7th on 2021 F2 Standings,rfci9y,Sports,ad1t,https://i.redd.it/3jxfpua6ba581.jpg,21,491,2021-12-13 10:10:36
Hockey India on Twitter: Congratulations @16Sreejesh on being the only Indian to earn a well-deserved Nomination for the World Games Athlete of the Year 2021. Cast your vote NOW to make your vote for Sreejesh count!,s16v6d,Sports,parlejibiscoot,https://twitter.com/TheHockeyIndia/status/1480503266911784963?s=20,7,56,2022-01-11 07:02:08
How Virat Kohli Moulded Himself Over the Years to Become India's Most Unlikely Test Captain,s4mlaz,Sports,ayazfarooque,https://caravanmagazine.in/vantage/virat-kohli-india-most-unlikely-test-captain,8,19,2022-01-15 15:24:08
Sindhu will fight World Rank 1 Tai Tzu Ying in the quarterfinals of the 2021 Badminton World Championships today at 2:30 pm for a place in the semis. The match will be telecasted on Star Sports 3 and Disney+ Hotstar.,rialy2,Sports,Orange2218,https://i.redd.it/fpd35ircm1681.png,15,297,2021-12-17 06:00:46
"Man, team India couldn't even get past the petrol price.",qjsim8,Sports,ApricotOk824,https://www.reddit.com/r/india/comments/qjsim8/man_team_india_couldnt_even_get_past_the_petrol/,107,1689,2021-10-31 16:01:02
"Kanpur Test: Day after going viral, 'Gutkha Man' Shobit says he is irritated with all the attention",r349pz,Sports,truthsayer1011,https://www.hindustantimes.com/cricket/india-vs-new-zealand-1st-kanpur-test-day-after-going-viral-gutkha-man-shobit-says-he-is-irritated-with-all-the-attention-101637978115541.html,42,420,2021-11-27 03:32:49
"2021 Badminton World Championships: Srikanth Kidambi wins silver, becomes the first Indian to do so. Lakshya Sen wins bronze.",rjz0v9,Sports,Orange2218,https://i.redd.it/uo8egif1qi681.png,9,406,2021-12-19 15:31:34
Good sportsmanship goes beyond the game.,qeyt4m,Sports,SumoneSumwere,https://i.redd.it/p6mdwunm5gv71.jpg,106,1939,2021-10-24 19:07:56
Did you guys know that Andrew Garfield used to be a Cricket coach?,s0gjhp,Sports,Plane-Imagination-57,https://www.reddit.com/r/india/comments/s0gjhp/did_you_guys_know_that_andrew_garfield_used_to_be/,6,27,2022-01-10 10:00:00
