title,id,flair,author,url,num_comments,score,timestamp
"India is set for an ANIL, AMBANI revolution - Billionaire Mukesh Ambani's Reliance Industries Ltd has floated Reliance New Energy Solar Ltd (RNESL) to operate its new energy business. Adani's logistics-to-energy conglomerate has set up a new subsidiary ANIL to handle and operate its renewable",s11o7e,Business/Finance,badbola,https://m.economictimes.com/industry/renewables/india-is-set-for-an-anil-ambani-revolution/articleshow/88804639.cms,12,27,2022-01-11 02:23:25
Why is no one talking about the recent news on Indian govt. banning crypto here?,r0i1s8,Business/Finance,thewildidea,https://www.reddit.com/r/india/comments/r0i1s8/why_is_no_one_talking_about_the_recent_news_on/,130,176,2021-11-23 17:13:39
Kotak plans legal action over BharatPe founder Ashneer Grover’s viral clip,rzzvl1,Business/Finance,dontdousemyfire,https://www.livemint.com/companies/news/kotak-plans-legal-action-over-bharatpe-founder-ashneer-grover-s-viral-clip-11641742271093.html,8,79,2022-01-09 19:52:30
"Just in: Japanese conglomerate Sony's Indian arm has finalised a deal with local rival Zee Entertainment to form the country's second largest entertainment network. The merged entity will include over 75 television channels, film assets and two streaming platforms.",rm2meo,Business/Finance,team_NITL,https://www.bbc.com/news/world-asia-india-59752065,21,153,2021-12-22 10:41:20
Another of Swiggy's shady business practices,r3526g,Business/Finance,orangeoracle116,https://www.reddit.com/r/india/comments/r3526g/another_of_swiggys_shady_business_practices/,71,316,2021-11-27 04:15:24
Fuck You HDFC,rsf1zw,Business/Finance,anonman369,https://www.reddit.com/gallery/rsf1zw,33,103,2021-12-30 23:11:38
India's billionaire Poonawalla family pledges $66 mln to Oxford University,rgrk50,Business/Finance,Impressive-Nose9110,https://www.reuters.com/world/india/indias-billionaire-poonawalla-family-pledges-66-mln-oxford-university-2021-12-15/,44,116,2021-12-15 05:29:17
Domestic two-wheeler sales are at a 10-year low. What does that tell us?,s4n9l4,Business/Finance,can_do_generation,https://www.livemint.com/economy/domestic-two-wheeler-sales-are-at-a-10-year-low-what-does-that-tell-us/amp-11642217845511.html,18,32,2022-01-15 15:55:38
I ordered milk from a new app they also provided testing kit and report of the product,rixdeu,Business/Finance,Bannedazz,https://www.reddit.com/gallery/rixdeu,50,428,2021-12-18 02:38:01
Royal Enfield Success Story,s4e7qk,Business/Finance,bluebadaam,https://youtu.be/LLX0ZCUDdoQ,5,4,2022-01-15 06:46:18
Elon Musk Says Tesla Not In India Due To 'Challenges With The Government',s3ity9,Business/Finance,WhiteShirttBlueJeans,https://www.ndtv.com/world-news/elon-musk-says-tesla-not-in-india-due-to-challenges-with-the-government-2705579,111,331,2022-01-14 04:06:28
Just make it 30,rlel0r,Business/Finance,ganga_gp,https://i.redd.it/vsqy56ntcw681.jpg,143,3140,2021-12-21 13:22:15
New age startups are another level down in the hellhole,rg6ptu,Business/Finance,bhoolabhatka,https://www.reddit.com/r/india/comments/rg6ptu/new_age_startups_are_another_level_down_in_the/,310,800,2021-12-14 12:44:50
Adani Group’s fourth company crosses ₹2 lakh crore in market capitalisation,s1w5xy,Business/Finance,RGV_KJ,https://www.thehindubusinessline.com/markets/adani-groups-fourth-company-crosses-2-lakh-crore-in-market-capitalisation/article38236897.ece,65,294,2022-01-12 03:33:36
5 rupees Lay's chip packet,r09uul,Business/Finance,gubenilekani,https://i.redd.it/46gt6ujyhb181.jpg,297,3656,2021-11-23 09:53:05
"Why was a profit-making PSU handed over to a company with less than 10 staff and no domain experience, asks Congress",rtkoyp,Business/Finance,nanrowdi,https://economictimes.indiatimes.com/news/politics-and-nation/why-was-a-profit-making-psu-was-handed-over-to-a-company-with-less-than-10-staff-and-no-domain-experience-asks-congress/articleshow/88579132.cms,80,306,2022-01-01 14:41:43
Now you will need to pay a minimum amount of Rs. 99 for your Airtel SIM's validity.,qzcu01,Business/Finance,IndiCoder18,https://i.redd.it/zeon937qp2181.jpg,464,1622,2021-11-22 04:20:28
The great Telecom Scam that is going on currently,rfa4ta,Business/Finance,mayonnaiser_13,https://www.reddit.com/r/india/comments/rfa4ta/the_great_telecom_scam_that_is_going_on_currently/,150,872,2021-12-13 07:28:18
Our fellow Subredditor Pradeep Poonia's voice against scams in Edtechs finally reached Lok Sabha,rgusvi,Business/Finance,Makadekana,https://v.redd.it/6uu2hyyj6o581,71,2413,2021-12-15 08:56:13
"India's ed-tech is a predatory market. Modi govt can learn from UK, US",s53d6k,Business/Finance,RGV_KJ,https://theprint.in/opinion/indias-ed-tech-is-a-predatory-market-modi-govt-can-learn-from-uk-us/801340/,21,226,2022-01-16 04:23:04
"Elon Musk’s Starlink India head quits, wants to live next to people who take responsibility for their actions",rx5rvz,Business/Finance,apocalypse31a5,https://www.tribuneindia.com/news/nation/elon-musks-starlink-india-head-quits-wants-to-live-next-to-people-who-take-responsibility-for-their-actions-358362,47,203,2022-01-06 04:41:48
Bought a pack of lays and got embarrassed,r32gdu,Business/Finance,bfangwoof,https://www.reddit.com/r/india/comments/r32gdu/bought_a_pack_of_lays_and_got_embarrassed/,235,1696,2021-11-27 01:57:06
"Meet Amrapali 'Ami' Gan, the Mumbai-born communications hotshot named new CEO of OnlyFans",rm2p1n,Business/Finance,mallurajput,https://www.dnaindia.com/business/report-meet-amrapali-ami-gan-the-mumbai-born-communications-hotshot-named-new-ceo-of-onlyfans-tim-stokely-2925082,73,399,2021-12-22 10:46:42
Vijay Shekhar Sharma says global market conditions impacted Paytm's IPO - The Economic Times,s2s2zs,Business/Finance,MrSpaceMania,https://m.economictimes.com/tech/startups/founder-vijay-shekhar-sharma-blames-bad-timing-for-paytms-flop-listing/articleshow/88853045.cms,37,66,2022-01-13 05:57:51
Resume mistakes I’ve seen on linkedin,r5im09,Business/Finance,my_100th_acc,https://www.reddit.com/r/india/comments/r5im09/resume_mistakes_ive_seen_on_linkedin/,222,717,2021-11-30 08:22:23
"India In Debt Trap, Its Youth Disillusioned, Says Global Survey",s56pnm,Business/Finance,prasiptasp,https://www.outlookindia.com/website/story/business-news-india-in-debt-trap-its-youth-disillusioned-says-global-survey/409477,23,108,2022-01-16 07:42:06
[TELECOM] Jio is following Airtel and Vi. New plan rates :,r4522v,Business/Finance,SacredBullshit,https://i.redd.it/sas39r6vfc281.jpg,197,761,2021-11-28 14:07:09
"Reliance checks into New York, buys Mandarin Oriental Hotel for around $270 mn",s08tvg,Business/Finance,Millenial909,https://m.economictimes.com/industry/services/hotels-/-restaurants/mukesh-ambanis-reliance-industries-buys-new-yorks-luxury-hotel-mandarin-oriental-for-usd-98-15-mn/articleshow/88781683.cms?s=09,24,104,2022-01-10 02:39:17
India's richest man is pouring more than $80 billion into green energy,s4117l,Business/Finance,Straight_Finding_756,https://edition.cnn.com/2022/01/14/business/india-reliance-gujarat-green-energy-investment-intl-hnk/index.html,24,68,2022-01-14 19:55:06
"Twitter CEO Jack Dorsey steps down, Parag Agrawal appointed successor",r4z6po,Business/Finance,NearbyMitron,https://www.oneindia.com/international/twitter-ceo-jack-dorsey-steps-down-parag-agrawal-appointed-successor-3341675.html,208,395,2021-11-29 16:13:02
Paytm Sinks To Record Low As Macquarie India Sees More Pain Ahead,s0lvr7,Business/Finance,MrSpaceMania,https://www.moneycontrol.com/news/business/markets/paytm-sinks-to-record-low-as-macquarie-india-sees-more-pain-ahead-7918501.html,25,84,2022-01-10 14:56:59
"Modi govt assures savings in EPF will be safe, despite Reliance Capital’s payment default | Senior official says govt always has a buffer or surplus from returns it makes on EPFO’s investments, which ensures that employees’ savings remain protected",rltj3i,Business/Finance,badbola,https://theprint.in/economy/modi-govt-assures-savings-in-epf-will-be-safe-despite-reliance-capitals-payment-default/784856/,27,93,2021-12-22 01:27:32
Unpopular Opinion: I lived in a small town and every time I needed something I had to travel 200kms. The local shop guys used to rip us off even if they had stock. Once Amazon and FK arrived in our place we finally can buy whatever a guy from Mumbai can buy. Long live e-commerce!,rg4j2w,Business/Finance,Cliff-Gamer,https://i.redd.it/azw3h9mkhh581.jpg,345,2799,2021-12-14 10:18:01
Vodafone Idea is practically nationalised: Govt becomes its largest shareholder,s1dgf5,Business/Finance,NearbyMitron,https://www.techradar.com/in/news/vodafone-idea-is-practically-nationalised-govt-becomes-its-largest-shareholder,9,39,2022-01-11 13:55:56
Government asks Apple to make goods worth $50 billion/year in India,rthsvr,Business/Finance,badbola,https://timesofindia.indiatimes.com/business/india-business/government-asks-apple-to-make-goods-worth-50-billion/year-in-india/articleshow/88624558.cms,4,68,2022-01-01 11:39:56
How should I finance/ invest my savings as a Student?,rz4lls,Business/Finance,SenpaiShubham,https://www.reddit.com/r/india/comments/rz4lls/how_should_i_finance_invest_my_savings_as_a/,11,5,2022-01-08 17:11:01
Crypto tax,resg0j,Business/Finance,Stopidbtch,https://www.reddit.com/r/india/comments/resg0j/crypto_tax/,47,11,2021-12-12 16:27:40
"2,783 foreign companies shut India operations since 2014: Govt to Parliament",rclklo,Business/Finance,gubenilekani,https://economictimes.indiatimes.com/news/economy/indicators/2783-foreign-companies-shut-india-operations-govt-to-parliament/articleshow/88170984.cms?from=mdr,17,124,2021-12-09 16:44:16
Feedback on our Idea,rzoj4w,Business/Finance,Massive-Ad-2841,https://www.reddit.com/r/india/comments/rzoj4w/feedback_on_our_idea/,6,13,2022-01-09 10:06:14
Apple iPhone factory workers (in Chennai) ate rotten food in rat-filled dorms: investigation,rs89ud,Business/Finance,Impressive-Nose9110,https://nypost.com/2021/12/30/apple-iphone-factory-workers-allegedly-fed-rotten-food-paid-under-5-a-day/,4,100,2021-12-30 18:17:54
"Another scam by Airtel. Yesterday they told us with multiple notifications that the new plan will get activated post current plan expiry, but my plan got activated yesterday itself. Today they removed that line from the offer. Isn't this misleading advertising?",r0yqeq,Business/Finance,vpsj,https://i.imgur.com/2geTD2r.png,29,208,2021-11-24 06:44:17
Whats a reason NPS is not a good investment even though it has income tax benefits?,s5eo91,Business/Finance,1987_20xx,https://www.reddit.com/r/india/comments/s5eo91/whats_a_reason_nps_is_not_a_good_investment_even/,5,5,2022-01-16 15:55:19
Job Opportunity,rznkln,Business/Finance,NoPaleontologist7841,https://www.reddit.com/r/india/comments/rznkln/job_opportunity/,9,5,2022-01-09 09:01:52
[Serious] Need help with finding a good bank,rvtv5p,Business/Finance,v_23b,https://www.reddit.com/r/india/comments/rvtv5p/serious_need_help_with_finding_a_good_bank/,20,2,2022-01-04 13:01:12
Adani enters steel business with $5 billion Posco pact,s4blwk,Business/Finance,RGV_KJ,https://timesofindia.indiatimes.com/business/india-business/adani-enters-steel-biz-with-5bn-posco-pact/articleshow/88885309.cms,5,7,2022-01-15 04:18:30
"UPI Transactions Value Crosses Record $100 Billion In October, On Track To End FY22 At Over $1 Trillion",qkt37w,Business/Finance,chai_18,https://www.moneycontrol.com/news/business/startup/upi-transactions-value-crosses-record-100-billion-in-october-on-track-to-end-fy22-at-over-1-trillion-7661711.html,96,312,2021-11-02 01:26:52
Call out Toxic work culture!,phnpx8,Business/Finance,Edijose45,https://i.redd.it/56dqjmn65gl71.jpg,365,5526,2021-09-04 08:25:38
ICAI openly selling data of CAs to CA election candidates,r66uw2,Business/Finance,user7-0,https://i.redd.it/ur30sllm4v281.jpg,26,152,2021-12-01 04:59:00
How to manage money obtained by selling property?,rzvby1,Business/Finance,2PinkHighlighters,https://www.reddit.com/r/india/comments/rzvby1/how_to_manage_money_obtained_by_selling_property/,7,7,2022-01-09 16:29:07
Help required in Mutual Funds selection,s0el7q,Business/Finance,Electrical-Deal-3149,https://www.reddit.com/r/india/comments/s0el7q/help_required_in_mutual_funds_selection/,6,5,2022-01-10 07:49:17
Maharashtra invites Elon Musk to set up Tesla plant in the state after Telangana,s5wi5n,Business/Finance,BhaswatiGuha19,https://auto.hindustantimes.com/auto/cars/maharashtra-invites-elon-musk-to-set-up-tesla-plant-in-the-state-after-telangana-41642318367488.html,5,4,2022-01-17 05:54:12
"EXCLUSIVE: Amazon says India revoking Future deal would boost Reliance, hurt competition",rgkrfa,Business/Finance,Motor-Ad-8858,https://www.reuters.com/markets/deals/exclusive-amazon-says-india-revoking-future-deal-would-boost-reliance-hurt-2021-12-14/,12,82,2021-12-14 23:45:18
Swiggy support in a nutshell...,pxzof2,Business/Finance,Lowlifeee,https://i.redd.it/hpkwalxt3hq71.jpg,146,2587,2021-09-29 16:58:59
Modern Day Feudalism - @violetreess,pvry3w,Business/Finance,spongebhakt,https://i.redd.it/xs5xhwcl0up71.jpg,184,1676,2021-09-26 11:19:51
"January 16 to be celebrated as 'National Start-up Day': PM Modi at interaction with start-ups, today.",s4ekse,Business/Finance,WhiteShirttBlueJeans,https://twitter.com/ANI/status/1482238652436856833?t=RGQCdIxCZmZnZCAEwni7qw&s=19,16,6,2022-01-15 07:09:15
Exclusive: How Govt Land Meant for the Needy Found Its Way to Firm Linked to Assam CM's Family,rbjm6t,Business/Finance,Jaamac2025,https://thewire.in/government/assam-government-land-himanta-biswa-sarma-rbs-realtors,20,191,2021-12-08 05:21:49
Airtel announces 20-25% tariffs hikes for prepaid offerings,qzc8au,Business/Finance,_random_error,https://www.thehindu.com/business/Industry/airtel-announces-20-25-tariffs-hikes-for-prepaid-offerings/article37619080.ece,47,190,2021-11-22 03:47:02
"With the way things going with paytm, is it safe to have FDs in paytm?",s0pmrm,Business/Finance,Logical_Body_4890,https://www.reddit.com/r/india/comments/s0pmrm/with_the_way_things_going_with_paytm_is_it_safe/,8,5,2022-01-10 17:39:01
Visit To A Dark Store: Here’s What It Takes To Deliver That Bag Of Groceries To You In 10 Minutes!,ropos5,Business/Finance,ppatra,https://www.moneycontrol.com/news/business/visit-to-a-dark-store-heres-what-it-takes-to-deliver-that-bag-of-groceries-to-you-in-10-minutes-7849131.html,14,26,2021-12-26 04:55:30
"India has a pretty low cost per GB of data, thanks to the highly competitive nature of our telcos. (Source: Finshots)",pdq999,Business/Finance,TheSkullCrushr,https://i.redd.it/vwhwjxdvr8k71.jpg,685,5159,2021-08-29 06:33:19
Lesson learnt: always use a credit card when paying for Swiggy (and their ilk).,q54o5c,Business/Finance,joker_of_the_deck,https://i.imgur.com/qaoIoSw.jpg,423,1310,2021-10-10 09:19:23
I observed this about Amazon deliveries today,rdt6ei,Business/Finance,anonman369,https://www.reddit.com/r/india/comments/rdt6ei/i_observed_this_about_amazon_deliveries_today/,32,199,2021-12-11 06:03:52
"Again, it is that time of the year, are you ready to claim tax deductions?",rq4x5s,Business/Finance,reddituserhere6,https://www.reddit.com/r/india/comments/rq4x5s/again_it_is_that_time_of_the_year_are_you_ready/,18,68,2021-12-28 03:01:07
"Gautam Adani Surpasses Mukesh Ambani, Becomes Asia's Richest Person",r1r30f,Business/Finance,Left_Writing_6820,https://www.india.com/business/breaking-gautam-adani-surpasses-mukesh-ambani-becomes-asias-richest-person-reliance-5108587/,62,288,2021-11-25 07:31:48
Help me become a farmer,rwj04z,Business/Finance,shama_lama_moo,https://www.reddit.com/r/india/comments/rwj04z/help_me_become_a_farmer/,18,15,2022-01-05 09:33:31
"As Foxconn Reopens Tamil Nadu Factory, Women Say They Don’t Want to Return",s4dxh0,Business/Finance,Straight_Finding_756,https://www.thequint.com/news/business/foxconn-reopens-tamil-nadu-sriperumbudur-factory-women-dont-want-to-return-food-poisoning-apple,5,46,2022-01-15 06:29:02
What % of salary do you save?,rzwqm4,Business/Finance,Tinkerbell_247,https://www.reddit.com/r/india/comments/rzwqm4/what_of_salary_do_you_save/,19,5,2022-01-09 17:33:19
When did History Channel become a full on BJP Propaganda network?,qky1qa,Business/Finance,ChumbaWambah,https://www.reddit.com/r/india/comments/qky1qa/when_did_history_channel_become_a_full_on_bjp/,140,557,2021-11-02 06:22:21
Amazon sues India's financial crime agency Enforcement Directorate (ED) in latest twist of Indian battle | Economic Times on Twitter,rm9y1q,Business/Finance,bhodrolok,https://twitter.com/economictimes/status/1473696804491481088?s=21,15,94,2021-12-22 17:20:14
PSA: Phonepe starts to charge ₹2 per every recharge as convenience fee,qlqjdx,Business/Finance,g7droid,https://i.redd.it/x62h1lztjcx71.jpg,145,555,2021-11-03 09:08:42
Paytm enables users to make payments by tapping phone on a PoS machine,rxeyam,Business/Finance,_AzAzAz_,https://www.reddit.com/r/india/comments/rxeyam/paytm_enables_users_to_make_payments_by_tapping/,15,9,2022-01-06 13:46:04
Buying cake online from Swiggy is way costlier than buying it directly from the shop,qqp15j,Business/Finance,GuruDev1000,https://www.reddit.com/r/india/comments/qqp15j/buying_cake_online_from_swiggy_is_way_costlier/,76,273,2021-11-10 07:36:59
Axis bank is not closing account and asking me to pay 20k inr for not. Maintaining min balance even after taking my signature on closure form and destroying welcome kit.,rg9m5f,Business/Finance,psonethree,https://www.reddit.com/r/india/comments/rg9m5f/axis_bank_is_not_closing_account_and_asking_me_to/,29,69,2021-12-14 15:14:18
SBI CC charging late fee of rs 850 on principal amount of rs 4300.,rqfxkb,Business/Finance,craziethunder,https://www.reddit.com/r/india/comments/rqfxkb/sbi_cc_charging_late_fee_of_rs_850_on_principal/,14,24,2021-12-28 13:30:32
This poster came along with the newspaper today. Sounds like an MLM scheme and they are targeting a vulnerable age group who are oblivious to modern day scams and traps.,r8i5sh,Business/Finance,devilwearsleecooper,https://i.redd.it/1wqcmrhvkg381.jpg,29,138,2021-12-04 05:06:36
"Here’s what you pay for a litre of petrol and diesel in your city on Monday, October 18, 2021:",qbrehz,Business/Finance,rkjan,https://www.reddit.com/r/india/comments/qbrehz/heres_what_you_pay_for_a_litre_of_petrol_and/,215,584,2021-10-20 02:55:43
Beware of Furlenco. They are like a leech that you can't get rid of.,rer1e7,Business/Finance,see-137,https://www.reddit.com/r/india/comments/rer1e7/beware_of_furlenco_they_are_like_a_leech_that_you/,24,97,2021-12-12 15:17:25
Alert: Money is Disappearing From EPF Accounts. Check Your Balance Regularly,rs3894,Business/Finance,badbola,https://taxconcept.net/epfo/alert-money-is-disappearing-from-epf-accounts-check-your-balance-regularly/,11,37,2021-12-30 14:36:57
Which Credit Card should one have to avail maximum discounts on Flipkart and Amazon India & other sites?,rut434,Business/Finance,Pankaj135,https://www.reddit.com/r/india/comments/rut434/which_credit_card_should_one_have_to_avail/,11,29,2022-01-03 04:39:04
#RejectZomato trends after chat support executive asks Tamil Nadu customer to learn 'national language Hindi',qb3xw0,Business/Finance,lungi_cowboy,https://www.indiatvnews.com/trending/news-rejectzomato-trends-after-chat-support-executive-asks-tamil-nadu-customer-to-learn-national-language-hindi-741069,230,812,2021-10-19 04:30:33
India’s telecom reforms are state extortion by another name,s2ohdh,Business/Finance,harddisc,https://www.livemint.com/opinion/online-views/indias-telecom-reforms-are-state-extortion-by-another-name-11641981849448.html,7,15,2022-01-13 02:50:48
How does significant amount of people survive eating road side food?,r2m9w2,Food,goal_it,https://www.reddit.com/r/india/comments/r2m9w2/how_does_significant_amount_of_people_survive/,59,76,2021-11-26 12:37:22
My dad's Jeera Rice and Dal Fry. For lunch today.,rgc8at,Food,Sensitive_Suspect_69,https://i.redd.it/8gz3icp4kj581.jpg,16,240,2021-12-14 17:15:57
Dal Makhani My Take With Tadka!,rckqq0,Food,todaystreatbyshail,https://www.reddit.com/gallery/rckqq0,20,266,2021-12-09 16:04:22
Maa made some khajoor-paak.,raut05,Food,MeetEleven,https://www.reddit.com/gallery/raut05,25,205,2021-12-07 08:53:21
Indians ordered 115 biryanis per minute in 2021: Report,rlyyyl,Food,RGV_KJ,https://www.deccanherald.com/national/indians-ordered-115-biryanis-per-minute-in-2021-report-1063197.html,14,68,2021-12-22 06:28:08
"So India, how is your plant based milk game ?",rztkub,Food,Omar_88,https://www.reddit.com/r/india/comments/rztkub/so_india_how_is_your_plant_based_milk_game/,16,2,2022-01-09 15:06:04
I just saw the Beyond Meat burgers in a store,rijz35,Food,felixfoxthot,https://www.reddit.com/r/india/comments/rijz35/i_just_saw_the_beyond_meat_burgers_in_a_store/,38,23,2021-12-17 15:34:04
Tandoori chai,r14274,Food,youcan_youcant,https://v.redd.it/1cr90fg4ej181,41,195,2021-11-24 12:26:14
What are your favorite lesser known instant coffee brands in India?,ryy4q1,Food,kunaldvanjare,https://www.reddit.com/r/india/comments/ryy4q1/what_are_your_favorite_lesser_known_instant/,8,9,2022-01-08 11:47:51
Matka pizza,q5rxc9,Food,jayy8143,https://i.redd.it/sgv8rbh1gss71.jpg,138,598,2021-10-11 09:15:20
"Haldirams Khatta Meetha from Sam's Club in US. Is this really authentic an Indian snack? Either way, it's delicious!!!",qzwi39,Food,parundrum,https://i.redd.it/vj4dk1l1u7181.jpg,42,112,2021-11-22 21:34:18
[OC] Bangalore Top 100 Biryani Restaurants compared on a Cost vs Avg. Rating basis,rx7fsy,Food,messidude,https://twitter.com/messidude/status/1478859406569717761?s=20,7,11,2022-01-06 06:11:14
Had some nostalgia after eating this(boondi bhujiya) after a long period of time,rge640,Food,Deadpool-07,https://i.redd.it/vmbj570qzj581.jpg,17,44,2021-12-14 18:43:20
"Ladies and gentlemen, Here is the Chole Bhature that I was served at an Indian restaurant in Stockholm, Sweden. I miss home.",q11d6x,Food,pillsburyboi,https://www.reddit.com/gallery/q11d6x,191,986,2021-10-04 08:29:08
"Quite a stir: A look at the 2-Minute revolution, as Maggi turns 40 in India",s53vyj,Food,East-Secretary,https://www.hindustantimes.com/lifestyle/art-culture/quite-a-stir-a-look-at-the-2-minute-revolution-as-maggi-turns-40-in-india-101642249764010.html,3,10,2022-01-16 04:51:40
"Watch: As Fire Brings Down Wedding, Guests Keep Eating In Maharashtra",r5jhax,Food,RantRantandRant,https://www.ndtv.com/india-news/watch-as-fire-brings-down-wedding-guests-keep-eating-in-maharashtra-2629670,21,156,2021-11-30 09:23:33
What's with veganism vs vegetarianism and what's good for you?,qfcnqx,Food,HeathCliff_008,https://www.reddit.com/r/india/comments/qfcnqx/whats_with_veganism_vs_vegetarianism_and_whats/,287,53,2021-10-25 09:09:19
Nihari!!!,q93wz7,Food,matif290,https://i.redd.it/zldqbyqaeqt71.jpg,95,1063,2021-10-16 03:26:05
are you planning to get a website for yourself or your business?,rz53og,Food,priyankeshu,https://www.reddit.com/r/india/comments/rz53og/are_you_planning_to_get_a_website_for_yourself_or/,6,9,2022-01-08 17:33:03
Soya Chilli & Butter Fried Rice. I have been trying to imitate chicken for some vegetarian friends and this was by far the closest I came!,qme5fk,Food,paranoidandroid7312,https://i.redd.it/kih0z4g3rix71.jpg,98,996,2021-11-04 06:00:12
"Daily per capita protein supply by country, 2017",rxf28q,Food,AffectionatePie981,https://ourworldindata.org/grapher/daily-per-capita-protein-supply,7,7,2022-01-06 13:51:28
So I just had Tikka Masala for the first time...,s3e6g3,Food,Tahoptions,https://www.reddit.com/r/india/comments/s3e6g3/so_i_just_had_tikka_masala_for_the_first_time/,7,3,2022-01-14 00:26:24
"Maybe a dumb question, but how do you get the salt right on the first attempt no matter how much the quantity of the food is?",riddhy,Food,halkafluff,https://www.reddit.com/r/india/comments/riddhy/maybe_a_dumb_question_but_how_do_you_get_the_salt/,41,53,2021-12-17 09:02:01
Are you consuming enough protein?research reveals majority of India are protein deficient.,rd9v06,Food,Dravidian06,https://www.reddit.com/gallery/rd9v06,159,258,2021-12-10 14:29:14
"Dakor town's famous Gota, crispy and savoury served with curd and tomato sauce",r8sf99,Food,todaystreatbyshail,https://www.reddit.com/gallery/r8sf99,44,315,2021-12-04 15:50:56
[OC] I'd like to meet the person who approved such a reductive translation of Pani Puri to be put on the packaging.,s1csgf,Food,6abhi6jeet6,https://i.imgur.com/RhKVCqI.jpg,187,2805,2022-01-11 13:22:19
My spices cupboard has finally reached its final form. What does r/India think of my assortment? love from France,s3pi4v,Food,mydriase,https://www.reddit.com/gallery/s3pi4v,136,1120,2022-01-14 10:45:42
"Thanks to /r/AayushXFX for suggesting JustMyRoots, Was craving Biryani from Thalapakatti Dindigul, and got to eat it in Pune, Delivered all the way from Chennai. :D",q6mme2,Food,sonuyosrox,https://i.redd.it/rw5c00iux0t71.jpg,135,523,2021-10-12 13:50:21
What do Indian states prefer - Wheat or Rice?,rx9ii8,Food,Orange2218,https://i.redd.it/ksexp3zq11a81.png,192,1151,2022-01-06 08:21:45
"Can’t expect world to eat greens, Vivekananda said meat was needed to make Indians mighty | In ‘Vivekananda’, Sankar writes that Vivekananda did not believe in the concept of vegetarianism for the hardworking poor of India",s2nj7i,Food,badbola,https://theprint.in/pageturner/excerpt/vivekananda-said-meat-was-needed-to-make-indians-mighty/800854/,158,227,2022-01-13 02:05:12
"Day 5 of the onepotmeal initiative for poor souls stranded on Streets of Pune. With this, we reached our first milestone of 100 meals. Chocolates as it's Makar Sankranti 🙏",s3miww,Food,phoodie_monk,https://www.reddit.com/gallery/s3miww,57,780,2022-01-14 07:30:20
"Have you ever had this fruit before? Saw it for the first time today, Cactus fruit!",rsoq7f,Food,orangepoopsickle,https://i.redd.it/3xwsoews2u881.jpg,182,563,2021-12-31 07:50:53
